0.0,1.0,0.0,0.0,What kind of person you are based on what you bought at the poster sale
0.0,1.0,0.0,0.0,To the driver of the BMW going 10km/h on Marine Drive
0.236,0.764,0.0,-0.5267,One in 10 female post-secondary students sexually assaulted in school setting: study
0.291,0.709,0.0,-0.6249,Equity & Inclusion Exchange re: Anti-Male Sexism and Anti-White Racism at UBC
0.0,1.0,0.0,0.0,ELEC 343...
0.688,0.312,0.0,-0.296,I am worried
0.0,1.0,0.0,0.0,HARSEV OSHAN - your next AMS PRESIDENT
0.252,0.748,0.0,-0.5719,Why do so many people on r/UBC seem to hate international students?
0.155,0.473,0.372,0.4939,"if the answer is yes, i've lost faith in humanity..."
0.304,0.696,0.0,-0.5423,Why the fuck do people talk in Koerner basement?
0.0,0.735,0.265,0.2023,/r/UBC Taylor Swift Albums Tournament - Semifinal 1
0.0,0.735,0.265,0.2023,/r/UBC Taylor Swift Albums Tournament - Semifinal 2
0.0,1.0,0.0,0.0,academic misconduct
0.0,0.649,0.351,0.4019,Courses to help prep for MCAT
0.0,0.517,0.483,0.4215,Hardest and Easiest Course/Major
0.231,0.769,0.0,-0.5106,Has anyone failed a 304 midterm and still managed to pass the course?
0.0,0.565,0.435,0.6597,TA giving higher marks to people with neat handwriting
0.0,1.0,0.0,0.0,Crypto club @UBC?
0.089,0.822,0.089,0.0,Seeing upper years generalize first years just because of some dumbasses throwing parties in dorms makes me (and probably other first years as well) feel unwelcome here
0.0,1.0,0.0,0.0,To the girls with 30 individuals order @TIM HORTONS
0.0,1.0,0.0,0.0,What really grinds my gears: The line for the 41 in Wesbrook Village
0.0,0.708,0.292,0.5106,Ubyssey's latest article makes fun of people with disabilities
0.0,1.0,0.0,0.0,Promotion to 4th year CS!!!
0.0,1.0,0.0,0.0,Andi Mack Fans?
0.0,0.838,0.162,0.4404,Is it better to get kicked out of ubc or graduate with a cgpa of below 3.0?
0.0,1.0,0.0,0.0,"Yesterday I assumed all engineers were in CIVL: Engineers of r/ubc, what is your program in a nutshell?"
0.0,1.0,0.0,0.0,Are we allowed to have a gaming console in our dorms in the first year?
0.0,1.0,0.0,0.0,"Interviewed UBC's Own, Bbno$ (Talks Becoming a Famous Rapper While Studying Kin)"
0.0,1.0,0.0,0.0,A guaranteed way I found to raise my grades
0.0,0.545,0.455,0.3612,Midterms got me like
0.0,1.0,0.0,0.0,Overheard at UBC
0.0,1.0,0.0,0.0,"STAT 302 (graded) assignment due April 10th - Is that ""legal""?"
0.0,1.0,0.0,0.0,Can people read the subreddits too?
0.0,1.0,0.0,0.0,is there a stat on how many UBC STEM graduates end up getting a job at the Big 4 (or any big tech companies in general) ?
0.132,0.72,0.148,-0.1531,UBC study finds women with straight A's in high school have same chances at leadership roles as men with failing grades
0.403,0.597,0.0,-0.4019,Is UBC neglecting domestic student?
0.0,1.0,0.0,0.0,Where can I talk to UBC freshmen???
0.0,1.0,0.0,0.0,Planning on Overthrowing UBC Housing
0.316,0.306,0.378,0.1531,Should I be Happy or Sad?
0.0,1.0,0.0,0.0,Ubyssey Article - Studying during the pandemic + returning to campus
0.0,0.641,0.359,0.4215,Building a faith community for Gen Y/Z
0.0,0.708,0.292,0.5106,Faculty of education launches 'long overdue' free anti-racism course
0.0,1.0,0.0,0.0,DO I HAVE TUTORIAL TODAY
0.0,1.0,0.0,0.0,What are those sheets with student names on them called?
0.714,0.286,0.0,-0.3612,Birb sucks
0.0,0.741,0.259,0.5423,Anyone receive the Trek award for their 4th year in Arts?
0.391,0.609,0.0,-0.4329,Student protest against UBC's handling of transit strike??
0.0,0.682,0.318,0.6808,CIS Championship culmination of “six year journey” for clean sheet queen Olivia de Goede
0.0,1.0,0.0,0.0,Is Sauder over hyped?
0.469,0.531,0.0,-0.8658,"BLM Protests and President Santa Ono's Letter to UBC: ""Together against Racism and Injustice"""
0.0,1.0,0.0,0.0,Just got into Biomed EE - Thoughts?
0.0,1.0,0.0,0.0,Keyboard Smashers
0.316,0.421,0.263,-0.128,I'm jealous of people like 69xine
0.0,1.0,0.0,0.0,"Do you have ""UBC"" in your instagram bio??"
0.0,0.696,0.304,0.5413,ANYBODY KNOW IF UBC SAVEON SELLS HALO TOP ????????
0.0,1.0,0.0,0.0,Current UBC BCom student AMA.
0.0,0.777,0.223,0.4871,hey nice to meet u what year are u in? do u live on campus?
0.239,0.761,0.0,-0.296,Missed a 2% assignment and I can't get over it
0.0,1.0,0.0,0.0,Question about student family residence
0.351,0.649,0.0,-0.4019,Has UBC SSC ever been hacked?
0.355,0.645,0.0,-0.765,Department gave me wrong information late last year and now I have to suffer financially/academically
0.0,1.0,0.0,0.0,Hoverboards in UBC Campus?
0.0,1.0,0.0,0.0,UBC TA relationships with students in class
0.18,0.82,0.0,-0.5574,"For Discussion: Journal Article published on ""Higher Racism: The Case of UBC - On The Wrong Side of History but Right Side of Optics"""
0.152,0.543,0.304,0.4215,Support thread for Indigenous students who are struggling the AW identity controversy <3
0.216,0.784,0.0,-0.5106,(CONFESSION) I am one of the students who cheated on the MATH 100 midterm.
0.0,1.0,0.0,0.0,Anyone else get really high grades this term?
0.0,1.0,0.0,0.0,Is forestry an unpopular degree?
0.0,1.0,0.0,0.0,Looking for things to do in the evening/night at/around UBC or in Vancouver!
0.0,0.764,0.236,0.5267,Homelessness ‘unacceptable’ in pandemic: UBC students sign open letter on housing justice
0.0,1.0,0.0,0.0,Paranormal experiences at UBC?
0.0,1.0,0.0,0.0,Are you not supposed to mention that you're a premed in interviews?
0.0,1.0,0.0,0.0,Anyone who gots >1st academic misconduct?
0.0,1.0,0.0,0.0,"If you guys ever plan to take a food delivery as a side gig job in Vancouver, just don't. I am getting less than minimum wage without considering the expenses on the first day. Just posting here because a few of them are also from UBC."
0.0,0.578,0.422,0.5638,Official transcript with blue ribbon?? Help!!
0.127,0.873,0.0,-0.1531,Looking for people who’s been negatively affected by construction materials on campus
0.0,1.0,0.0,0.0,Social Media/ Student Privacy Lawyer Brad Shear confirms Chegg most likely handing out user info to schools
0.0,1.0,0.0,0.0,7 pm exams
0.0,1.0,0.0,0.0,I just found out a secret to studying
0.434,0.566,0.0,-0.4714,why so much spam UBC!
0.535,0.465,0.0,-0.3182,Lost Airpod pros
0.0,0.464,0.536,0.5374,UBC Tuition Increase - CONFUSED!!!!
0.0,0.648,0.352,0.4215,Statement in support of Black Lives Matter and #ShutDownSTEM
0.0,1.0,0.0,0.0,Have you recently given birth or are currently pregnant?
0.5,0.5,0.0,-0.6124,Racist flier I found at UBC
0.0,1.0,0.0,0.0,420 Club at UBC?
0.0,1.0,0.0,0.0,College Experience at UBC Questions?
0.39,0.428,0.183,-0.5244,At UBC do we really support victims of violence/sexual assault?
0.407,0.593,0.0,-0.6705,"So yesterday I saw the word ""fuck capitalism"" at the protest"
0.0,1.0,0.0,0.0,Are we permitted to be human in our 18th year?
0.467,0.533,0.0,-0.5423,CPSC 110 will destroy me
0.0,0.484,0.516,0.4939,Birb has a new friend
0.0,1.0,0.0,0.0,economics program ethnicity
0.0,1.0,0.0,0.0,The Dingbat: Why I think campus should stay closed
0.0,1.0,0.0,0.0,"Will The Ubyssey, The Peak, and other sources cover the termination of Wolf?"
0.0,1.0,0.0,0.0,Use your own room...
0.0,1.0,0.0,0.0,Re: The Talon
0.0,0.939,0.061,0.0772,Can someone give me the thing to do if I arrive to Vancouver in the order? (Like setting up phone number etc
0.0,1.0,0.0,0.0,Happe Canada Day!
0.238,0.762,0.0,-0.5709,"While Pres. Gupta ignores most critical questions in #AskArvind Twitter townhall, students stage a sit-in outside his office"
0.0,0.58,0.42,0.4404,UBC deserves a better meme community
0.0,1.0,0.0,0.0,was gonna study for midterms tonight
0.0,1.0,0.0,0.0,Engineering Physics INTERVIEW - Anybody have any tips or thoughts?
0.0,1.0,0.0,0.0,LGBT/gay groups on campus?
0.0,1.0,0.0,0.0,What are your thoughts on the event being hosted by the Muslim Students' Association this Thursday?
0.286,0.591,0.123,-0.5106,Jewish Orgs Denounce University of British Columbia Student Clubs for Promoting Conspiracy Theories About Jews
0.492,0.508,0.0,-0.4404,WASH YOUR DIRTY HANDS
0.249,0.517,0.234,-0.0382,Don't Lose Hope - Education should be a priority.
0.0,1.0,0.0,0.0,In need of UBC Medical students for Ubyssey Article
0.0,0.828,0.172,0.4404,UVic student wondering if anybody at UBC would be willing to do me a library-related favour.
0.0,1.0,0.0,0.0,MATH/CPSC/STAT tutor available for hire
0.0,0.417,0.583,0.6369,Best washrooms on campus?
0.318,0.682,0.0,-0.2183,Why is life so hard ?
0.0,0.822,0.178,0.0772,the real reason you want online exams
0.571,0.13,0.299,-0.2732,Stop Just Please Stop
0.0,1.0,0.0,0.0,Sorority Reputations
0.0,1.0,0.0,0.0,Your thoughts on UBC being an Asian University
0.0,0.786,0.214,0.5994,We are creating a community for UBC students to talk about mental wellbeing. Help us in our developments by completing a survey.
0.167,0.833,0.0,-0.296,Letter: Far-right speakers have no place in university auditoriums or community halls
0.0,0.745,0.255,0.34,"Thunberg, Henry to receive honorary degrees from UBC"
0.0,1.0,0.0,0.0,Does anyone else think the Translink vote is a little fishy?
0.0,1.0,0.0,0.0,Playboi Carti ?
0.0,0.886,0.114,0.2023,What kind of people get into top American universities for graduate school? (for quantitative majors)
0.25,0.75,0.0,-0.25,We should also do a mental health protest.
0.0,0.755,0.245,0.4389,Please sign this petition to make vaccines and masks mandatory at UBC this fall!
0.0,0.828,0.172,0.3612,If classes go online do we get refunded for things like parking passes?
0.0,1.0,0.0,0.0,maskless BUFFOONS
0.0,1.0,0.0,0.0,2nd year specializations are out!!
0.0,1.0,0.0,0.0,Ask Iman: An advice column for the university student who’s trying to get by
0.375,0.625,0.0,-0.34,Reluctance for in-person fall. So?
0.292,0.708,0.0,-0.5106,any logic to scaling a failing student up to passing?
0.0,0.775,0.225,0.6868,Is Canada Goose worth it for next winter and does it feel like summer when you wear one?Any other tips for next winter to stay warm?
0.0,1.0,0.0,0.0,Ben Shapiro @ UBC Chan Center now on youtube
0.0,1.0,0.0,0.0,99 on the weekend is very unreliable
0.0,1.0,0.0,0.0,AMS candidates doing shots
0.59,0.41,0.0,-0.863,UBC is in danger of deletion! TO WAR!
0.368,0.632,0.0,-0.5423,fail two courses in the first term
0.0,0.67,0.33,0.8122,Do you drive to campus and park in a parkade? Take my survey to win some free coffee!
0.0,0.737,0.263,0.3612,Letter: Being the only survivor in the room
0.133,0.718,0.149,0.0757,This does not look good for Fall Term. Hopefully people get their vaccinations when required
0.0,0.752,0.248,0.5106,UBC Free Speech Club don red “MAGA” hats for launch event
0.0,1.0,0.0,0.0,Taking Group Projects a Step Beyond
0.0,1.0,0.0,0.0,Things to do in UBC and area
0.0,1.0,0.0,0.0,Which faculty should I choose for first year?
0.49,0.51,0.0,-0.5851,Why is Math 100/180 so ridiculously hard?
0.275,0.375,0.349,0.1511,"STOP RAINING, LIKE FOR REAL !"
0.0,1.0,0.0,0.0,This should go without saying but recent developments suggest that UBC students could use a reminder
0.0,0.581,0.419,0.6514,I voted in my undergrad society's election! :D
0.2,0.8,0.0,-0.4588,Is turning down an offered club position considered rude or an expected possibility?
0.0,1.0,0.0,0.0,The Current Hypocrisy of this Subreddit
0.0,0.423,0.577,0.6249,Make r/UBC Great Again
0.08,0.92,0.0,-0.4995,"APPLIED SCIENCE DEAN MANIPULATING STUDENTS AND PROFESSORS. The dean of the Faculty of Applied Science, Professor James Olson, made an announcement about the final exam form due to COVID. However, students and faculty staff received 2 very different versions."
0.0,0.732,0.268,0.5106,"The Ubyssey, The UBC Free Speech Club, and Jordan Peterson"
0.0,1.0,0.0,0.0,J.K. Rowling brings magic to UBC: buys Irving
0.0,0.663,0.337,0.6808,On a scale of SFU to Tomorrowland how good are the parties at UBC?
0.0,1.0,0.0,0.0,Here is a recap of last week's 90's Night hosted by CHBE and MTRL Engineering!!
0.688,0.312,0.0,-0.296,missing Toronto
0.0,0.876,0.124,0.4019,Right To Education: Help Make The 15 Million In Scholarships Dollar That Go Unclaimed At UBC Each Year More Accessible.
0.0,1.0,0.0,0.0,Quizzes Outside of Class
0.0,1.0,0.0,0.0,Porn Filmed on Campus.
0.0,1.0,0.0,0.0,"It's Islam Awareness Week! Ask our speaker anything, and watch it live at 11:00 AM PST"
0.0,0.508,0.492,0.4404,Safe Campus UBC website
0.0,0.526,0.474,0.4019,Orchard commons party :$@“:$:&
0.0,0.714,0.286,0.1531,UBC should invite Milo Yiannopolous
0.0,1.0,0.0,0.0,UBC Food Services Exploitation
0.448,0.552,0.0,-0.8074,Have you experienced sexual harassment or sexual assault on public transit?
0.429,0.571,0.0,-0.4588,Mods are abusing their power.
0.0,1.0,0.0,0.0,What do you think about people wearing medical mask around campus ?
0.0,1.0,0.0,0.0,Vancouver ranked 6th most expensive city in the world to attend university from abroad
0.0,0.8,0.2,0.3612,UBC Sent Students 'Approved' Document To Educate Them on 'Yellow Privilege'
0.0,1.0,0.0,0.0,Sqwark?
0.0,0.413,0.587,0.6901,Really wish UBC was a party school….
0.0,1.0,0.0,0.0,What percentage is required to get major in bachelor of arts computer science in second year for an international student
0.0,1.0,0.0,0.0,"If you're old enough to attend UBC and have the time to write long Reddit posts, you have enough time and capacity to do your research on the historical and current relationship between the Canadian government and Indigenous people."
0.116,0.694,0.191,0.3182,"Follow-up regarding UBC Men's Rights Association protest (AMS banning, discrimination claim, free speech protest)"
0.0,0.795,0.205,0.4754,Any reason why Fjallraven Kanken backpacks are really popular with girls on campus?
0.034,0.844,0.122,0.4939,Clearly the student body voted for the SUS rep that's being bashed on this subreddit. Do I like him? No. But you voted for him. Maybe consider this a moment about why it's important to do your homework and make informed voting choices and get involved.
0.0,1.0,0.0,0.0,To the Person Who Made Me Aware of the Existence of My Hair
0.247,0.753,0.0,-0.5574,[UBC Alumni] “I feel sub-human”: The faces of Donald Trump’s travel ban
0.0,0.577,0.423,0.4466,CS website is down D:
0.0,1.0,0.0,0.0,Can't wait to do a group exam portion tomorrow with the covid numbers...
0.0,1.0,0.0,0.0,gender-specific events at UBC
0.0,1.0,0.0,0.0,Masks in IKB
0.0,0.921,0.079,0.4574,"The Ubyssey Magazine is interested in learning about the diversity of UBC students! This year, we are running a diversity survey that asks questions related to topics such as race, gender, sexuality, mental health, and financial status."
0.0,1.0,0.0,0.0,"We need a new megathread called ""I'm dropping this course, who wants my seat?"""
0.255,0.426,0.319,0.1531,Interest in a UBC firing range/gun club?
0.444,0.556,0.0,-0.34,Anyone else not....too stressed?
0.193,0.807,0.0,-0.4767,Why are some female washroom lines so long on campus that its actually unfair?
0.259,0.741,0.0,-0.5423,Letter: UBC’s Centre for Accessibility and its outdated policies fail students
0.0,1.0,0.0,0.0,Working for a professor part time while taking courses?
0.0,0.488,0.512,0.6369,Campus Freedom Index: UBC's Ranking
0.0,1.0,0.0,0.0,Pre-Med Alternative Path
0.0,1.0,0.0,0.0,I took this photo of that mysterious steam encircling one of the metal mushroom chain things.
0.0,1.0,0.0,0.0,Not-high-enough grades...
0.162,0.838,0.0,-0.4019,an open letter to the annoying male that lives above me in the orchard commons.
0.0,1.0,0.0,0.0,Are you a MECH student looking for a summer project?
0.268,0.732,0.0,-0.5106,Inb4 the outrage comes pouring in cause of Snowmageddon 3.0
0.0,1.0,0.0,0.0,"Franz Kurtzke (September 7th, 2017)"
0.263,0.737,0.0,-0.3612,Why do people complain about food so much?
0.0,0.881,0.119,0.3182,The Cube of Truth is returning to UBC this Friday (March 1) from 1:00 PM to 5:00 PM.
0.273,0.727,0.0,-0.128,Whats up with todays strike?
0.0,1.0,0.0,0.0,SSC MARKS
0.0,1.0,0.0,0.0,CAPS
0.0,1.0,0.0,0.0,Why are most PhD students international?
0.0,0.732,0.268,0.0258,Late Withdrawal of a course
0.292,0.708,0.0,-0.5106,i only took one course this term and still failed
0.183,0.817,0.0,-0.7717,"To illustrate how arbitrary (stupid and unfair) the elections admin (and his decision) is, this is the offending profile picture that violated the rule for ""campaigning outside campaign period"" posted 1 day early."
0.0,1.0,0.0,0.0,Obligatory OMG its snowing at UBC post
0.0,1.0,0.0,0.0,So which of you did this? Found it in the back of math 100
0.383,0.617,0.0,-0.4767,iClicker represents everything wrong with lectures
0.0,1.0,0.0,0.0,Engineering/CS Dating Life
0.0,0.526,0.474,0.2023,Yearround Housing Chances?
0.0,1.0,0.0,0.0,Sign-Up for Student Directed Semianr ACAM 447C: Mental Health and the Asian-Canadian Diaspora
0.0,0.805,0.195,0.4404,"Made a Tumblr called ""What's Different in Canada"" - should be useful for UBC-bound Americans"
0.0,1.0,0.0,0.0,University Vlog
0.481,0.519,0.0,-0.5719,Depression for getting to CS
0.0,1.0,0.0,0.0,Unpopular opinion: Post-Secondary Education is not a right
0.211,0.703,0.086,-0.5118,So I want to get into medical school [no bullying pls]. What do I need to do?
0.0,1.0,0.0,0.0,[Parody] Colors of the Wind
0.171,0.695,0.134,-0.1779,The “UBC students against bigotry” twitter account is saying anybody who supports Trump is hateful
0.0,1.0,0.0,0.0,RCMP Issue Warning...
0.0,0.962,0.038,0.0772,"How university students infantilise themselves: Our students need to grow up, in the most political way, by wresting control of the educational process from an administrative bureaucracy that wields way too much authority already."
0.0,0.874,0.126,0.3802,Have you been to Aberdeen Centre and/or Parker Place? Please take this quick survey for our geography research project!
0.0,0.704,0.296,0.6369,Where is the best place in vancouver to find a sugar daddy?
0.0,1.0,0.0,0.0,"People are already registered for fourth year seminars, and registration hasn't even opened yet!"
0.142,0.858,0.0,-0.2057,Is it academic misconduct to purposely not do well on an exam?
0.0,1.0,0.0,0.0,What have your profs said about President Trump and which class was it?
0.0,0.828,0.172,0.3612,AMS apologizes to Indigenous peoples for not making ‘serious efforts to advance reconciliation’
0.0,1.0,0.0,0.0,Cadaver studies in any UBC biology courses?
0.155,0.845,0.0,-0.0258,Indigenous knowledge systems often overlooked in academia
0.262,0.594,0.144,-0.3384,I really regret UBC's decision to extend the winter break.
0.0,1.0,0.0,0.0,I am a new Computer Science student who will be vlogging my experience throughout the term!
0.0,1.0,0.0,0.0,ITS SNOWING!!!
0.667,0.333,0.0,-0.6124,Is UBC racist?
0.0,1.0,0.0,0.0,"UBC people of UBC, what are you going to UBC next term?"
0.0,0.469,0.531,0.6739,"This school is AMAZING, but...."
0.0,1.0,0.0,0.0,Any other Bengalis coming to UBC (Vancouver)?
0.0,1.0,0.0,0.0,Are all course marks scaled on a bell curve for first years?
0.0,1.0,0.0,0.0,Dispensary on/near campus?
0.0,1.0,0.0,0.0,UBC FALL 2021
0.241,0.759,0.0,-0.2263,Class action lawsuit against the UBC bookstore
0.0,0.589,0.411,0.4199,CUS Club Promoting Huawei WTF?!
0.0,0.294,0.706,0.5859,Help on getting accepted?
0.196,0.804,0.0,-0.296,The aftermath of chair’s resignation at the Board of Governors
0.474,0.526,0.0,-0.4019,Math 104 triangle problem
0.254,0.699,0.048,-0.765,Oh hell no.... you didn’t. These campaigns getting intense and I’ve decided to vote for which ever candidate bothered me the least.
0.126,0.756,0.118,-0.0516,[CBC Opinion] Let them cheat: Why it's tempting for college and university instructors to look the other way Social Sharing
0.0,1.0,0.0,0.0,Review: Being a CPSC 210 TA
0.0,0.821,0.179,0.34,UBC meme pages build community by satirizing shared campus experiences | The Ubyssey
0.0,1.0,0.0,0.0,First and Second Year Computer Science Major Review!
0.0,0.848,0.152,0.3612,When I’m not a student I’m a programmer. This is what the working world is like now.
0.27,0.644,0.087,-0.6092,"With the recent events around the globe, I can't stop feeling completely pissed off at the current world"
0.0,0.526,0.474,0.5574,UBC Geer's Make a Positive Statement
0.0,1.0,0.0,0.0,What can I do?
0.0,0.575,0.425,0.5719,Where is everyone celebrating 4/20 at?
0.0,1.0,0.0,0.0,"Take that, Talon!"
0.0,1.0,0.0,0.0,Wearing Masks
0.281,0.719,0.0,-0.8402,Unpopular opinion: people who cough consistently (every 10 seconds) in silent study areas are as rude and annoying as people who talk obnoxiously in those areas
0.0,1.0,0.0,0.0,Houston flood Ubyssey article
0.0,1.0,0.0,0.0,Where did Birb go?
0.0,1.0,0.0,0.0,There actually are dissenting voices re: UBC's covid policies.
0.0,1.0,0.0,0.0,What about UBC ?
0.0,1.0,0.0,0.0,Is there a way to opt out of the UPass
0.545,0.455,0.0,-0.34,A rant about bussing
0.0,1.0,0.0,0.0,Keep Studying Now
0.61,0.39,0.0,-0.4824,RANT: Pharmacology major
0.0,1.0,0.0,0.0,"How is Ahmed Awad, CPSC 213?"
0.0,1.0,0.0,0.0,We're from myUBCcourseisfull and we just overhauled our entire site. Check it out and ask us questions!
0.0,1.0,0.0,0.0,Will fall 2021 be in person? I think not.
0.0,0.769,0.231,0.2023,Are textbook readings for CPSC 304 important?
0.0,0.916,0.084,0.3182,Vegans of UBC and Anonymous for the Voiceless will be bringing a Cube of Truth to the plaza outside The Nest tomorrow (Friday) from noon 'till 5 PM.
0.0,1.0,0.0,0.0,UBC Coyote
0.145,0.855,0.0,-0.296,ENGL112 Complaint: 45% of course mark is based on a poorly designed (and wrong) topic.
0.0,0.617,0.383,0.4767,Watching American vax’d friends get Covid
0.0,1.0,0.0,0.0,IMAGINE DAY ORIENTATION LEADER HIRING
0.323,0.677,0.0,-0.7992,We had UBC vs. UCB battle. But now it's time for UBC vs. UFC all out war.
0.135,0.783,0.083,-0.296,Lachlan Williams: Surprised and disappointed by UBC Faculty of Applied Science's decision to go online for all coursework in fall
0.0,1.0,0.0,0.0,"A few hours past the ""W"" deadline and got ""W"""
0.0,1.0,0.0,0.0,Students travelling home due to COVID-19: The Ubyssey wants to hear from you!
0.0,1.0,0.0,0.0,Masters schools in Europe for CS. I need advise
0.0,1.0,0.0,0.0,Garbage at UBC
0.0,0.526,0.474,0.2023,To the top
0.0,1.0,0.0,0.0,Converse Public Access Ep. 2: Miley Cyrus x Ann Makosinski
0.0,1.0,0.0,0.0,Outlook of gay students at UBC
0.0,1.0,0.0,0.0,A splintered movement: How the far-right found a foothold on campus
0.0,0.691,0.309,0.5366,is it really true that the pharmacist is not in demand anymore?
0.0,1.0,0.0,0.0,"An article ""Am I the last person against SkyTrain to UBC"""
0.0,1.0,0.0,0.0,Anybody else concerned about the Delta variant???
0.383,0.617,0.0,-0.4767,Need advice: Poor Prof/TA Virtual Skills
0.432,0.568,0.0,-0.6523,RANT: UBC CPSC built a wall to stop CPEN students
0.0,1.0,0.0,0.0,Anyone else think cases will be skyrocketing again prior to sept and classes will have to go back to online?
0.0,1.0,0.0,0.0,The Ubyssey is Hiring a Web Developer for January!
0.3,0.455,0.245,-0.1531,"Rejected from cs, need support and assistance"
0.0,1.0,0.0,0.0,I THINK I GOT 100% ON MY MATH 105 MIDTERM!!
0.0,1.0,0.0,0.0,y'all remember them 😌
0.0,0.823,0.177,0.4199,Hey guys ! What elective do you recommend talking in first year as a GPA booster?
0.239,0.761,0.0,-0.5719,[MOD APPROVED][Part 2 of Study] Recruiting Participants: Evaluating Trauma from Protests in the Hong Kong Community Since 1997
0.545,0.455,0.0,-0.34,Rant: Registration Times
0.544,0.147,0.309,-0.3818,God I hate this
0.0,0.543,0.457,0.6369,Best resume writing services for internships
0.0,1.0,0.0,0.0,Trash requests
0.0,1.0,0.0,0.0,"Phi Delta Epsilon presents: Harry Potter Trivia Night on November 17th, 2017 at 7pm"
0.0,1.0,0.0,0.0,"After less than a month since the campus-wide shutdown, can we talk about UBC's initial response?"
0.0,1.0,0.0,0.0,Waiting for an outbreak
0.0,1.0,0.0,0.0,Bus Drivers not wearing masks
0.0,1.0,0.0,0.0,Housing at ubc
0.0,1.0,0.0,0.0,Dr. Jordan B. Peterson LIVE! Tickets on sale now
0.387,0.613,0.0,-0.5836,Car Racing Noise in Campus so Annoying!
0.0,1.0,0.0,0.0,UBC students who have gone on to work in fintech
0.0,1.0,0.0,0.0,Is there any news or ideas on how classes may be formatted in sept of 2021?
0.263,0.737,0.0,-0.4588,Extinction Rebellion UBC plans hunger strike if board of governors doesn't order full divestment from fossil fuels
0.0,1.0,0.0,0.0,sadgesadgesadgesadgesadgesadgesadge
0.0,1.0,0.0,0.0,Tuum Sex: Condoms
0.0,1.0,0.0,0.0,Moe
0.0,1.0,0.0,0.0,Another AUS Elections Post... but spicy
0.0,1.0,0.0,0.0,Should I go to my Co-op interview?
0.0,0.837,0.163,0.5106,"Free Speech Club makes edgy, cringeworthy McDonalds advocacy video, and interviews David Eby, who doesn't realize the context."
0.0,1.0,0.0,0.0,Have you ever met a pick up artist at ubc?
0.0,1.0,0.0,0.0,Check out the Thunderbird dance team performing at Mens varsity basketball game
0.0,0.724,0.276,0.6369,UBC doing what it does best: more trees were ripped out today
0.0,1.0,0.0,0.0,Why is this subreddit so anti-Sauder?
0.247,0.753,0.0,-0.3182,At a loss and don't know what to do
0.0,1.0,0.0,0.0,Is there a lot of K-pop at UBC?
0.0,1.0,0.0,0.0,Will people look down on me if I decide to study biogeographical sciences?
0.0,1.0,0.0,0.0,DoorDash/Uber eats on campus
0.0,1.0,0.0,0.0,Why quite a lot ubc students wear all in black?
0.0,1.0,0.0,0.0,"Transgender (FTM) incoming student - hormones, surgery?"
0.0,1.0,0.0,0.0,My college's bookstore sells these...
0.0,1.0,0.0,0.0,At what point in your career do you expect to earn at least as much as your parents?
0.0,1.0,0.0,0.0,Random story
0.247,0.753,0.0,-0.5574,Are we seeing an end to evangelical culture wars? Maybe at UBC
0.0,1.0,0.0,0.0,Lets have a Party/Bar night!!!
0.0,0.635,0.365,0.3182,"Please, take 5 min password survey"
0.104,0.896,0.0,-0.1027,How hard is it to land a job after graduating from an Arts degree?
0.0,1.0,0.0,0.0,The Ubyssey: Who should you vote for?
0.0,1.0,0.0,0.0,Looking for Fellow Queers
