0.0,0.923,0.077,0.4408,UBC Homecoming 2021 is virtual again!? Someone please start a petition. They can fill up lecture halls but not have an outdoor celebration??? (I may be misreading this but I don’t see any mention of in person celebrating)
0.0,1.0,0.0,0.0,Get vaccine on UBC campus (Pharmaceutical building site)
0.0,1.0,0.0,0.0,How do you live with not being able to get into medical school?
0.35,0.404,0.246,-0.3217,"In wake of sexual assaults, Campus Security issues warning to not commit sexual assault"
0.0,0.894,0.106,0.0772,Should UBC require mandatory vaccines for all students who return to campus?
0.0,1.0,0.0,0.0,"Rappers Without Borders, the hub for UBC's hip hop aficionados"
0.0,1.0,0.0,0.0,Looking for tips on after-care after using public transit or going to public spaces
0.0,1.0,0.0,0.0,Fined in UBC parkade for charging my EV at a 120v outlet
0.0,1.0,0.0,0.0,400-level anime class??
0.0,1.0,0.0,0.0,This is the week to prep your resume for the TCF.
0.0,1.0,0.0,0.0,Taking second year math courses as a first-year. How f*cked am I?
0.0,1.0,0.0,0.0,Any recommendations for schools to go to for Go Global?
0.0,1.0,0.0,0.0,Anti-Israel Referendum
0.0,0.874,0.126,0.3182,Hip-Hop Artist Kimmortal alleges UBC Astronomy Club responsible for funding a giant telescope built on Native Hawaiian Land
0.0,0.615,0.385,0.3612,AMS Events Promoting a Convicted Felon
0.0,0.865,0.135,0.3612,[Ubyssey] Taking exams in a different time zone? I'd like to know what options are available to you.
0.0,0.69,0.31,0.4019,Why do professors wish for our downfall?
0.0,1.0,0.0,0.0,Smoking at UBC?
0.0,0.588,0.412,0.6369,What I love about Daylight Savings so far
0.0,1.0,0.0,0.0,LONG LIVE THE OC PENISMAN!
0.0,1.0,0.0,0.0,What's the rule on attending lectures you're not registered in? And for someone that's not a student.
0.0,1.0,0.0,0.0,Professor released all midterm grades and comments publically
0.571,0.429,0.0,-0.6113,People are so selfish
0.783,0.217,0.0,-0.5574,Ban Turnitin
0.212,0.788,0.0,-0.5423,Two Education profs post editorial about UBC's bad record on hiring Black academic managers
0.0,1.0,0.0,0.0,Life of An Engineering Student | Ubyssey
0.0,1.0,0.0,0.0,"WorldGaming exec calls UBC the team to beat in Counter-Strike, Hearthstone and Starcraft (@20:49)"
0.0,1.0,0.0,0.0,Former Stanford gymnast Hailee Hoffman vaults towards graduation as a UBC master’s student
0.0,1.0,0.0,0.0,Don't ever say mainland China students don't know what is democracy.
0.0,1.0,0.0,0.0,Coronavirus: Details revealed for B.C’s return-to-school plan in September - Could this mean January may be in person? (Just Speculating)
0.0,1.0,0.0,0.0,Place to do push-ups on campus?
0.0,1.0,0.0,0.0,math 221
0.119,0.881,0.0,-0.2865,Why tickets to events are so fcking expensive and why is it so hard to get them?!
0.0,1.0,0.0,0.0,how about not going out... the news keep talking about a third wave
0.0,0.828,0.172,0.4404,"UBC and Bonnie Henry are right. Students are safe, and really so is everyone else"
0.0,0.833,0.167,0.3818,"Dear UBC: ""Important"" emails are those about immigration, COVID-19, registration, etc. Not imagine day."
0.0,0.632,0.368,0.8885,"Teresa Hanul-Seo, a UBC psychology student who is half-Korean, half-African, and 17 other young talents celebrate beauty of diversity through photos, videos"
0.0,0.792,0.208,0.6996,"I made a move in day video (my sister in first year moved in!), in case anyone wants to see what the process is like :)"
0.0,1.0,0.0,0.0,Slenderman visits UBC prank
0.234,0.766,0.0,-0.0572,"UBC, I don't want to live"
0.0,0.673,0.327,0.5267,UBC Social Justice Reform Manifesto by Franz Kurtzke
0.0,1.0,0.0,0.0,I'm running for Vice President of Academic and University Affairs for the AMS! AMA!
0.675,0.325,0.0,-0.886,Buchanan Tower tragically unharmed after devastating campus-wide fire
0.0,0.725,0.275,0.2263,Is smoking weed okay on campus?
0.0,1.0,0.0,0.0,How to swim at UBC Aquatic Center
0.0,0.377,0.623,0.5106,Just for fun
0.0,1.0,0.0,0.0,Even cartoon characters are running in this election
0.0,1.0,0.0,0.0,what’s happening during halloween weekend?
0.144,0.778,0.078,-0.2732,Warning to students who want to go into interview-based programs about COVID behaviour (esp. medicine)
0.0,1.0,0.0,0.0,What do you do with money earned from coop?
0.217,0.573,0.21,-0.0258,Free Speech Activist Franz Kurtzke Assaulted on Main Mall (w/ Audio)
0.247,0.753,0.0,-0.3182,Concerns about the lack of stringent COVID-19 protocols?
0.0,0.633,0.367,0.5399,Need Advice on 1st Year Courses! Thanks!
0.0,1.0,0.0,0.0,"People who sit in lecture and don't take notes, WHY????"
0.0,1.0,0.0,0.0,Masks Required in Indoor Spaces at UBCO
0.0,1.0,0.0,0.0,Looking to get professional headshots taken on campus
0.0,1.0,0.0,0.0,When do you hear back about arts co op?
0.132,0.377,0.491,0.5859,Writing Credits are Hard - WriteAway can Help
0.0,1.0,0.0,0.0,A quiet evening on campus
0.0,1.0,0.0,0.0,We Are Still In the Midst of A Pandemic! Some Etiquette Reminders
0.0,1.0,0.0,0.0,"First internship at Big Company, Advice?"
0.0,1.0,0.0,0.0,UBC CPSC admissions has caused me to hit rock bottom
0.524,0.476,0.0,-0.296,Stop saving seats
0.0,0.877,0.123,0.2732,UBC Aerospace Engineering Student Teams are running a referendum to create a $3 fee for all UBC students
0.0,0.833,0.167,0.3818,Jordan Peterson’s UBC talk helps explain why he appeals to centrists and Nazis alike
0.63,0.37,0.0,-0.1779,Housing anxiety
0.178,0.747,0.075,-0.4215,Unpopular opinion: People are using the pandemic as an excuse for their poor academic performance
0.0,1.0,0.0,0.0,How is the social life at UBC?
0.0,0.593,0.407,0.8931,"a week in my life at UBC vlog :) figured some of you like this sort of content, good luck on exams!!"
0.0,1.0,0.0,0.0,UBC and AMS shortcomings during COVID-19 (and otherwise)
0.0,1.0,0.0,0.0,What should I watch out for when asking a Korean guy out?
0.212,0.455,0.333,0.3802,Great News! BDS referendum fails to meet quorum.
0.0,0.781,0.219,0.2401,Don't forget to report racial microaggressions on campus!
0.338,0.662,0.0,-0.6249,The Scandal at UBC Keeps Growing—but No One Has Been Held Accountable
0.28,0.72,0.0,-0.5974,ATTENTION: Do not go to the library if you're fucking sick!
0.274,0.726,0.0,-0.5994,Anybody else feel anxious or scared to discuss their opinion on topics such as politics?
0.0,1.0,0.0,0.0,HomeComing
0.0,0.856,0.144,0.4019,"First year coming to UBC, so I’m guessing I shouldn’t ever in public say I support Republicans over Democrats?"
0.195,0.527,0.278,0.0276,"hey guys, feeling really lost right now.... need supportive guidance."
0.0,1.0,0.0,0.0,Would you mind responding to my survey so I can finish ENGL301?
0.0,1.0,0.0,0.0,Roommate's boyfriend is here everyday
0.0,0.417,0.583,0.6808,Interesting or easy classes at UBC
0.0,0.826,0.174,0.2732,Black law students push for increased diversity at UBC law school
0.0,0.787,0.213,0.4019,What was your experience using adderall/other drugs to help you study
0.0,0.357,0.643,0.2023,YRH chances?
0.0,1.0,0.0,0.0,Ubyssey interview about undergrad experience throughout the pandemic
0.0,1.0,0.0,0.0,Meanwhile in the fraternity
0.0,1.0,0.0,0.0,My professor did not wear a mask during the 80 minute lecture today
0.106,0.806,0.088,-0.128,The Ubyssey on Twitter - #BREAKING: A Black graduate student alleges Campus Security denied him access to a campus building in a racial profiling incident. Story to come.
0.0,1.0,0.0,0.0,"Making a difference: 1st Year Kinesiology student, Ava Katz, squeezes seniors’ errands in between exams"
0.0,1.0,0.0,0.0,Why are there so many websites (half of which are not mentioned) that professors expect you to look at
0.0,1.0,0.0,0.0,Ubyssey Callout: BIPOC Health and Mental Health Experiences
0.0,1.0,0.0,0.0,311 is a course that needs to be restructured.
0.239,0.761,0.0,-0.782,What happens to students who are arrested or sentenced to prison? would they still be allowed to attend lectures and complete their degrees or placed on academic probation?
0.0,0.703,0.297,0.6705,Easy way to get ALL your student loans forgiven if you study the biomedical sciences
0.0,1.0,0.0,0.0,Did this lady graduate from UBC or is she still attending?
0.0,1.0,0.0,0.0,What is considered senior level?
0.0,1.0,0.0,0.0,Sauder dean fires student body
0.217,0.783,0.0,-0.3612,Why is it difficult to get over 90 in Sauder?
0.0,1.0,0.0,0.0,"I designed a Thunderbirds shirt, what do you think?"
0.0,1.0,0.0,0.0,Unpopular Opinion: The First Year Academic Dishonesty Drama is BS
0.0,1.0,0.0,0.0,we are
0.643,0.357,0.0,-0.2023,Controversial Opinion
0.0,1.0,0.0,0.0,Pass final to pass course policy
0.464,0.536,0.0,-0.3818,People abandoning their bikes
0.0,0.69,0.31,0.4019,Asian Student Support Group @ UBC Counselling Services
0.391,0.609,0.0,-0.6696,Why is the community at OC so bad?
0.0,1.0,0.0,0.0,"People who sit in lecture and only take notes, WHY????"
0.213,0.787,0.0,-0.2869,UBC now stands for University of B??ching and Complaining
0.0,0.707,0.293,0.4404,Where do all the attractive people study at?
0.0,0.698,0.302,0.3818,CONSULTATION: Thoughts on 4 credit courses in science
0.0,1.0,0.0,0.0,Has anyone here achieved a 100.0% winter session average?
0.0,1.0,0.0,0.0,Someone just slipped paper under MY door this time!
0.0,1.0,0.0,0.0,Anybody here going to the Playboy Carti concert in November?
0.122,0.878,0.0,-0.3612,Can Sauder students complain to Access and Diversity if they are unable to meet the standards of formal attire?
0.0,1.0,0.0,0.0,"I spent 2 days to write an essay in my class to receive a ""barely-passed"" grade"
0.192,0.557,0.251,0.2406,Sad about your marks? Happy about your marks? Donate to Sprouts.
0.0,0.721,0.279,0.7351,To the cute girl who sat beside me and friend on the R4 and the Train on halloween...
0.0,1.0,0.0,0.0,Compsci Personal Projects
0.535,0.465,0.0,-0.3182,Lost: Monster Headphones
0.0,1.0,0.0,0.0,Just got this outside the nest. Anyone going?
0.087,0.786,0.127,0.1986,"Video from friend, graffiti from UBC women's washroom (mentions Jordan Peterson, radical feminism, trans ideology, alt-right, etc). As a man, I found it surprising to see this angry, political messaging in a washroom. Am I just visiting more polite men's washrooms? Thoughts?"
0.0,0.803,0.197,0.7469,"Come to our awesome party, but you can only enter if you understand String Theory, can recite the Bible and backwards, survive by photosynthesis, and own a house in Vancouver. But please come anyway."
0.148,0.671,0.181,0.128,Letter: Online school can no longer be justified as a public health measure
0.0,0.714,0.286,0.4939,Why is Wealth allowed to advertise in the Nest?
0.0,1.0,0.0,0.0,To the Sauder Students who got 100% (or above 90%) on the COMM 205/ COMM 294 Final Exams...
0.0,1.0,0.0,0.0,CPSC 103 academic misconduct meeting!
0.0,0.746,0.254,0.6996,UBC student gives a talk on judging people by how they look - powerful! Support her & comment on the Youtube link.
0.0,1.0,0.0,0.0,"Will vaping be considered ""cheating"" during remote exams?"
0.0,1.0,0.0,0.0,"Underground basketball, lacross, ball hockey, and soccer courts, instead of the parkade at MacInnes Field Parkade?"
0.0,0.631,0.369,0.6249,An open letter to /r/UBC: Y'all are awesome.
0.0,1.0,0.0,0.0,Where on campus can you measure your height?
0.221,0.481,0.298,0.2023,Triumph over your weakling classmates with Objectivism
0.0,1.0,0.0,0.0,Are there a lot of Arabs or people from the Middle East at UBC?
0.891,0.109,0.0,-0.802,"Insecure, hopeless, stressed out"
0.0,1.0,0.0,0.0,GRSJ backlash against the mens' rights club.
0.0,0.649,0.351,0.4019,Need R Script Help - Loops and Subsets
0.259,0.741,0.0,-0.1027,Question about SOCI Classes/Instructors Bias
0.18,0.757,0.063,-0.6908,"Hello. I am not Dario G. and I have never spoken with him. However, I disagree completely that the public should be devoid of valuable information that could sway votes because he apparently (arguably) broke some stupid rule. Here is his platform/campaign. Have a read."
0.0,1.0,0.0,0.0,"do you pronounce it ""EYE kayyyy BUI"" or ""AYY KEY BEE""?"
0.23,0.77,0.0,-0.3989,I have my first midterm tomorrow and currently am extremely nervous!
0.0,1.0,0.0,0.0,UBC Occultism -a new club coming in September of 2018
0.0,1.0,0.0,0.0,Looking to borrow an N driver sticker
0.0,1.0,0.0,0.0,UBC Plug's Recent Video Receives Backlash due to Stereotyping and Misogyny
0.538,0.462,0.0,-0.5423,SHOULD I FAIL ON PURPOSE?
0.0,1.0,0.0,0.0,Your firsts at UBC
0.0,1.0,0.0,0.0,"Hey UBC, maybe don't sell concert space right next to a residential area."
0.0,0.69,0.31,0.4019,Concern over AAPS support of proctoring issues
0.0,1.0,0.0,0.0,Ask Iman: The second group of newbies
0.34,0.174,0.486,0.1739,I'm gonna die! Please help!
0.144,0.5,0.356,0.34,UBC organizers join national student walkout in solidarity with Wet’suwet’en land defenders
0.0,1.0,0.0,0.0,"People of UBC, who is Actually from Vancouver?"
0.0,0.665,0.335,0.5473,UBC CS PAID RESEARCH PARTICIPANT OPPORTUNITY ($CAD 30/hour)
0.406,0.594,0.0,-0.8481,"UBC Journalist in Residence Eternity Martis, debunks racism and sexual violence on Canadian campuses"
0.0,1.0,0.0,0.0,anyone knows what tf happened to tbird residence last night
0.204,0.796,0.0,-0.6249,"[RANT] This Exchange construction outside Gage is the worst thing to ever happen to UBC, bar none."
0.0,1.0,0.0,0.0,Ubc repainting the Engineering Cairn again
0.155,0.845,0.0,-0.296,"Letter: It's time to stop using the term ""snake"" to describe Sauder students"
0.0,1.0,0.0,0.0,Fall decision
0.0,1.0,0.0,0.0,Stay at home pt6
0.071,0.929,0.0,-0.1531,Don’t let me catch you getting on my crowded-ass 33 at 5pm and then getting off two stops later at Westbrook Village...
0.297,0.533,0.17,-0.3336,You're Really Better Off Ignoring Anyone You Dislike Having an Event on Campus
0.474,0.526,0.0,-0.5574,Can we ban kinost yet?
0.58,0.42,0.0,-0.6298,Shit smell in Nest???
0.0,1.0,0.0,0.0,W2020 1st Year students where are you coming from?
0.367,0.633,0.0,-0.4404,math 100 can suck my balls
0.0,1.0,0.0,0.0,Why so many downvotes at UBC reddit?
0.0,1.0,0.0,0.0,UBC pre-med kids can relate 😩
0.556,0.444,0.0,-0.3612,Online class sucks
0.0,1.0,0.0,0.0,Carpool from UBC to Delta
0.0,1.0,0.0,0.0,If an old person walks on the bus ...
0.26,0.563,0.177,-0.4404,"Japanese 151. A beginners language class disguised as a death sentence for your GPA, considering you are a true beginner."
0.49,0.392,0.118,-0.8225,UBC BoG chair endorses questionable viewpoints regarding injustice and racism on Twitter
0.0,1.0,0.0,0.0,Any places near UBC that sell cigarettes?
0.403,0.597,0.0,-0.5233,Why so many incompetent exchange students
0.0,1.0,0.0,0.0,PSA-Prospective CS Majors at UBC
0.0,1.0,0.0,0.0,"re: Ubyssey article claim of ""transphobic speaker"" visiting campus"
0.0,1.0,0.0,0.0,The Enduring Silence of UBC’s ‘Hunting Ground’ - All you new students should read this
0.0,1.0,0.0,0.0,Looking for suggestions on handling/maintaining a mask while on campus (Vancouver)
0.0,0.776,0.224,0.4374,Please voice your concerns! There is a question about recorded lectures too!
0.0,1.0,0.0,0.0,What happens if you sleep through a midterm?
0.0,1.0,0.0,0.0,Calling all undergraduate students in the Faculty of Science!
0.231,0.769,0.0,-0.2023,The Talon is complaining about remembrance day
0.0,1.0,0.0,0.0,Ubyssey Interview on Mental Health Resources
0.0,0.283,0.717,0.8221,"Respect freedom of speech, separatists!"
0.0,0.853,0.147,0.5859,Looking for students who are around campus to beta test a new website for finding food at UBC ⭐(chance to win a $25 giftcard 🤑)
0.0,1.0,0.0,0.0,Why do Sauder kids have club positions as a job on facebook?
0.231,0.769,0.0,-0.34,Made a mistake on my cover letter to WestPeak Research
0.0,0.734,0.266,0.4404,"Stay classy (yes, I'm classist, deal with it), Talon"
0.0,1.0,0.0,0.0,UBC SHUTDOWN?
0.0,1.0,0.0,0.0,"Sororities at UBC, what to expect?"
0.0,0.69,0.31,0.4019,Anybody interested in joining a Neural Network Club?
0.275,0.725,0.0,-0.2263,"Undecided between UW & UBC, any advice?"
0.306,0.694,0.0,-0.296,How to avoid drug(cannabis) at UBC?
0.0,0.548,0.452,0.765,Americans of UBC: Who do you hope wins the election?
0.0,0.764,0.236,0.5719,UBC celebrated its 100th anniversary in 2008. Why are we doing it again?
0.0,1.0,0.0,0.0,rate this timetable out of 10
0.0,1.0,0.0,0.0,Bookstore? Web Design?
0.0,1.0,0.0,0.0,In Person Classes
0.0,1.0,0.0,0.0,UBC IS ON CLUBHOUSE!
0.0,1.0,0.0,0.0,A message to the brick
0.0,1.0,0.0,0.0,Should we ... chill?
0.0,1.0,0.0,0.0,Ethics & tech inquiry for computer science students
0.0,1.0,0.0,0.0,UBC student turns the windows of his res into a game of Space Invaders
0.0,1.0,0.0,0.0,Anyone going to the Jojo Siwa Concert Tomorrow (Aug. 20) at Thunderbird Stadium???
0.649,0.351,0.0,-0.5719,I hate you all
0.0,1.0,0.0,0.0,me irl
0.318,0.553,0.129,-0.6249,Lowlifes: saw a woman and her CHILD stealing from the charity deposit box outside of ponderosa
0.655,0.345,0.0,-0.5859,WTF IS BURNING
0.0,1.0,0.0,0.0,APSC 160 final?
0.132,0.868,0.0,-0.4404,Any Other Science Students (or Profs) Get Tired of Media Members Not Understanding The Basic Fundamentals of Science (Re COVID)
0.412,0.588,0.0,-0.4215,freaking out about turning 20
0.0,0.889,0.111,0.3595,"We are Solidarity for Palestinian Human Rights -UBC. We're currently campaigning ""Yes"" for the BDS referendum next week - Ask Us Anything!"
0.0,1.0,0.0,0.0,2017 Summer Term 2-CPSC210
0.131,0.51,0.359,0.6416,"2 years ago, an international student died. Please check-in with your friends &/or reach-out for support. You are NOT alone 😇"
0.0,1.0,0.0,0.0,Online graduation is completely out of touch
0.375,0.625,0.0,-0.34,Am I obsessing over nothing? (self-doubt)
0.0,1.0,0.0,0.0,Jordan Peterson and more LIVE!
0.0,1.0,0.0,0.0,"How long should the ""why are you eligible?"" blurbs for the Affiliation Scholarships be?"
0.0,1.0,0.0,0.0,Wearing tactical gear to class
0.0,0.541,0.459,0.1779,ICE. Amazon. Thoughts?
0.0,1.0,0.0,0.0,How do we get rid of faculty student societies?
0.0,1.0,0.0,0.0,Frats: A Discussion
0.0,1.0,0.0,0.0,Enrolment Annual Report 2019-2020 (PDF)
0.0,1.0,0.0,0.0,Question about Class Attendance
0.756,0.244,0.0,-0.4767,Unfair Grading
0.0,0.732,0.268,0.296,Join the discussion about moderation in /r/UBC
0.5,0.5,0.0,-0.7906,What UBC will do to rape accusations without prove?
0.0,1.0,0.0,0.0,Is it possible to get a CPSC TA position if you have retaken the course?
0.0,1.0,0.0,0.0,First Year Social Events
0.0,1.0,0.0,0.0,Is it just me or are people blowing in person exam concerns out of the water?
0.252,0.748,0.0,-0.4019,"Prof calls it what it is, student cries foul."
0.0,1.0,0.0,0.0,I don’t wanna do online school
0.0,1.0,0.0,0.0,Looking for a math 200 tutor
0.0,1.0,0.0,0.0,What are some high-paying jobs for those with a Computer Science Degree?
0.219,0.781,0.0,-0.4215,Can we conclude that generally students are unhappy with/being at UBC?
0.0,1.0,0.0,0.0,Get your popcorn: VP Academic Debate
0.0,1.0,0.0,0.0,Transfer into Ubc summer 2016
0.0,1.0,0.0,0.0,"TIL a Sauder exam was rescheduled due to Imprint, and moved onto Chinese New Years (tomorrow)"
0.0,0.796,0.204,0.3182,What are the odds of securing a tenured position in academia?
0.0,0.925,0.075,0.0772,Motion coming to UBC-V Senate proposing targeted number of Black hires and fellowships for international Black students.
0.0,1.0,0.0,0.0,FoM NSERC USRA GPA
0.0,1.0,0.0,0.0,FANTASY FRIDAY
0.0,1.0,0.0,0.0,SFU UBC 2019 meme war..... let’s go!!!!
0.0,1.0,0.0,0.0,"Club Crawl 2018 Finale: From Orange You Came, To Orange You Shall Go"
0.0,1.0,0.0,0.0,Why STAT 302 final at 7pm are much harder than the 3:30 one?
0.0,1.0,0.0,0.0,Don’t take off ur mask while in library..
0.134,0.762,0.104,0.2425,"Fellow Gen Z's, are you happy knowing that studying hard at UBC is a journey that may or may not help you reach the quality of life that your parents have achieved?"
0.0,1.0,0.0,0.0,UBC or UofT?
0.367,0.633,0.0,-0.4404,I am tired of the ultra-liberalism @ UBC
0.0,0.594,0.406,0.6249,How can we make UBC great again?
0.0,0.708,0.292,0.5106,UBC Free Speech Club hosts talk by Jordan Peterson
0.0,1.0,0.0,0.0,UBC or stay at SFU?
0.0,1.0,0.0,0.0,Education Library
0.0,0.859,0.141,0.4215,This is why we aren't allowed to have nice things UBC. Went on a walk tonight and found this...
0.367,0.633,0.0,-0.4404,Should I transfer to Sauder? Yikes :(
0.0,0.633,0.367,0.4404,Safe return to the Fall semester
0.0,1.0,0.0,0.0,That math 102 midterm was trash.
0.0,1.0,0.0,0.0,Being Short at UBC
0.0,0.213,0.787,0.5719,Perfect Imperfection
0.0,0.478,0.522,0.872,"I've started a new UBC confessions. Please like, tell your friends and submit stuff :)"
0.375,0.625,0.0,-0.5574,Food Services Plastic Straw Ban and Accessibility
0.0,0.465,0.535,0.3182,Science Fair Ideas
0.0,0.787,0.213,0.7514,Got above 80% for this winter session but my SSC doesn’t say Deans Honour List on it? Did the requirements change?
0.0,0.766,0.234,0.6369,"Get your pearls ready for clutching, there's an application to put a Cannabis store in the old Copy Smart location."
0.0,1.0,0.0,0.0,STATISTICS IS NOT COMPUTER SCIENCE AND DATA SCIENCE AND MACHINE LEARNING ARE NOT THE ONLY THINGS IN COMPUTER SCIENCE
0.0,0.8,0.2,0.3612,Seen on the UBC Class of 2019 FB group: meme enthusiast
0.608,0.392,0.0,-0.4767,unfair final exam
0.0,1.0,0.0,0.0,Ben Shapiro is coming to UBC on Halloween night
0.0,0.708,0.292,0.8834,"I love when my studies inspires new documentaries. This documentary in development with Nigel Howard was inspired by the new ETEC 565C Course on Ableism, Equity, and Educational Technology."
0.444,0.556,0.0,-0.34,A rant on r/ubc content
0.0,1.0,0.0,0.0,Halloween Club Crawl Poster Bounty
0.0,1.0,0.0,0.0,Men's Right Activism
0.0,1.0,0.0,0.0,To the man who took my photo on the #33 bus tonight
0.158,0.842,0.0,-0.3094,Any pro-lifers here? What do you think about the protests (from both sides)?
0.239,0.761,0.0,-0.296,Is there presently no atheist clubs in UBC?
0.0,1.0,0.0,0.0,BIRB!?!?!
0.0,1.0,0.0,0.0,...
0.0,1.0,0.0,0.0,Some thoughts re: Dr. Amie Wolf
0.0,0.842,0.158,0.128,Should legal actions be taken against prep101 and/or BYC?
0.0,1.0,0.0,0.0,Exposure notice
0.0,0.766,0.234,0.6705,Change My View: Awards like this are BS because women are not discriminated against and are hardly underrepresented in STEM
0.0,0.283,0.717,0.8225,Wow caffeine pills are amazing
0.22,0.78,0.0,-0.1761,Try so hard and still get a 72.
0.0,1.0,0.0,0.0,TA Offers on Careers Online/Symplicity
0.0,1.0,0.0,0.0,"Fraternities and their outdated ideas of manhood have to end, by Dr Marina Adshade"
0.625,0.375,0.0,-0.6115,Really Stupid Question I’m Sorry
0.0,1.0,0.0,0.0,Ghosted
0.0,1.0,0.0,0.0,Analysis-chan
0.0,1.0,0.0,0.0,Chinese only signs at UBC
0.262,0.619,0.118,-0.3382,Why can't people just leave the Cairn alone???
0.0,1.0,0.0,0.0,Where are my new Integrated Sci buddies??
0.176,0.824,0.0,-0.4939,"""...and his manifesto cites Sam Harris, Christina Hoff Sommers, and Jordan Peterson."" Jesus, ideas are scary."
0.3,0.7,0.0,-0.4588,"So, my account was banned from this subreddit."
0.0,1.0,0.0,0.0,SFU Vs UBC
0.0,0.476,0.524,0.5106,Free Parking On Campus?
0.245,0.755,0.0,-0.6369,"Are first-years allowed to spam annoying ""Are first-years allowed to [do something totally harmless]"" questions on this sub?"
0.0,1.0,0.0,0.0,Learning English
0.0,1.0,0.0,0.0,PSA: Walk quietly and keep chairs off linoleum floors
0.0,1.0,0.0,0.0,How to see final exam marks?
0.0,0.617,0.383,0.4767,Looking for Christian friends at UBC
0.0,1.0,0.0,0.0,Letter: UBC needs to finally hold fraternities accountable
0.0,1.0,0.0,0.0,‘Long overdue’: Student calls for AMS to implement Indigenous committee
0.231,0.769,0.0,-0.4019,My one homework problem took more pages than your final
0.175,0.5,0.325,0.296,Credit Card to pay for rent?
0.0,0.517,0.483,0.4215,Sauder rumours are true.
0.0,1.0,0.0,0.0,How's the diversity @ UBC?
0.0,1.0,0.0,0.0,UBC or SFU? [CS]
0.0,0.464,0.536,0.5374,UBC PLEASE GO ONLINE!!!!!!!!
0.0,1.0,0.0,0.0,In-Person Fall 2021 is Doable with Lecture Recordings
0.362,0.106,0.532,0.1531,"I'm Stupid, Please Help?"
0.0,0.508,0.492,0.7003,Do girls take longer to accept friend requests?
0.0,1.0,0.0,0.0,Some ways I tried to deal with the heat wave...
0.429,0.571,0.0,-0.4588,COGS 402 = forced unpaid internship
0.0,1.0,0.0,0.0,Prof refuses to accommodate final exam time
0.0,1.0,0.0,0.0,Is there anywhere on campus I can still study at?
0.0,1.0,0.0,0.0,UBC student Carson Binda makes bid for seat in Vancouver Kingsway riding
0.0,1.0,0.0,0.0,Dispensaries near UBC?
0.071,0.929,0.0,-0.0191,What's the point of selecting a program of study if it generally doesnt matter for jobs?
0.0,0.728,0.272,0.6696,"Professor Marina Adshade did a TEDX talk in 2015! ""Economics and female sexual freedom"""
0.269,0.593,0.139,-0.6705,"I got accepted but might fail one of my grade 12 classes, what are the chances my offer will be cancelled?"
0.63,0.37,0.0,-0.1779,Tinder awkwardness
0.0,1.0,0.0,0.0,Why do people say Math and Comp Sci are similar?
0.0,1.0,0.0,0.0,How to date international Chinese girls?
0.0,1.0,0.0,0.0,UBC Surrey campus
0.146,0.854,0.0,-0.4404,"do you think the availability of Upass, public transportation and Skytrains are delaying or discouraging students from driving?"
0.0,1.0,0.0,0.0,Is there a place to learn how to cook on campus?
0.0,1.0,0.0,0.0,"""To be eligible for this position you must be a Canadian citizen, a permanent resident or a refugee"""
0.0,1.0,0.0,0.0,UBC Smash Rankings
0.0,1.0,0.0,0.0,Ubyssey Interview - Students in Upper-Year Residence
0.219,0.781,0.0,-0.4215,"On a scale of 1-10, how much do you regret attending UBC"
0.0,1.0,0.0,0.0,Vote Viola Chao for AUS VP Academic!
0.0,1.0,0.0,0.0,UBC Science Zoom Account Pronoun Field
0.0,0.79,0.21,0.6115,"Just finished my first year, and I’m really happy with how I did. Small flex post ❤️"
0.383,0.617,0.0,-0.4767,Disappointed in my second term grades
0.0,1.0,0.0,0.0,Men at B.C.’s biggest university step forward as #metoo campaign continues
0.0,1.0,0.0,0.0,UBC or Queen's?
