0.688,0.312,0.0,-0.8316,Ugh. And people complain when they fail
0.524,0.476,0.0,-0.296,Retrieving Missing Items
0.0,1.0,0.0,0.0,"COVID Omicron variant spreading really fast, will courses go online again at some point?"
0.387,0.613,0.0,-0.5849,How to Absolutely Destroy First Year Engineering
0.0,1.0,0.0,0.0,How many vehicles can I link for one parking permit at UBC?
0.0,0.849,0.151,0.3595,Consider helping UBC learn more about Modern and Open Relationship Experiences (MORE) through this survey!
0.0,1.0,0.0,0.0,Should SkyTrain ride the rails to UBC? Professor Patrick Condon of the UBC School of Architecture says a SkyTrain extension to the university is not needed
0.0,1.0,0.0,0.0,Does the UBC CS major have gender quotas?
0.284,0.37,0.346,0.128,Another lost AirPods post lol
0.0,1.0,0.0,0.0,Cheese pizza at Pi r 2
0.0,1.0,0.0,0.0,Reddit Reconciliation: Franz Kurtzke for VP Academic
0.152,0.69,0.159,0.0258,"please stop turning on webcam during the lecture man, i'm begging you"
0.0,1.0,0.0,0.0,How would you say Uvic differs from UBC (good & bad) ?
0.0,1.0,0.0,0.0,UBC Coat Of Arms Redesign
0.0,0.784,0.216,0.0258,Why do AMS Elections Matter?
0.0,0.641,0.359,0.6808,This is the latest guy the UBC Free Speech Club is inviting
0.0,1.0,0.0,0.0,UBC Grading and Scaling Policy
0.0,1.0,0.0,0.0,Dean of Science Scholarship
0.167,0.833,0.0,-0.2023,"As “active classes” becomes empty, I guess I don’t need this anymore."
0.0,0.633,0.367,0.4404,A gender-balanced world is good for science
0.0,1.0,0.0,0.0,UBC shitpost
0.15,0.602,0.248,0.3182,"UBC event cancelled, debate continues about free expression on campus"
0.236,0.545,0.218,-0.0516,Depressing post: How do you guys find motivation?
0.0,0.843,0.157,0.0772,Why do you want to get into CPSC?
0.0,1.0,0.0,0.0,I live on campus and my fb posts were monitored by the staff admin
0.0,0.776,0.224,0.3804,I guess this type of relationship is more acceptable in Quebec?
0.0,1.0,0.0,0.0,CPSC 213 Folks: Nobody really knows why we need to learn it
0.0,1.0,0.0,0.0,How likely is it that I'll be having sex today?
0.0,0.857,0.143,0.25,Do you think there’s any chance tomorrow’s (Monday’s) exams will get moved online?
0.0,1.0,0.0,0.0,Any socialist students at UBC?
0.247,0.753,0.0,-0.5574,Is it illegal to take recyclable bottles and cans from blue bins?
0.0,0.263,0.737,0.4215,Easiest Engineering
0.0,1.0,0.0,0.0,What can I major in if I enter through the BA department?
0.0,1.0,0.0,0.0,Just a few more hours till we can talk about that lab exam....
0.0,0.595,0.405,0.5267,Pro-Social Justice Essay by Franz Kurtzke
0.0,0.8,0.2,0.4574,"I'm an Arts student looking to take the MCAT, and I need some help!"
0.0,0.638,0.362,0.6249,Douglas Todd: Top moral thinkers defend free speech in UBC clash
0.0,1.0,0.0,0.0,Goodnotes vs notability
0.0,1.0,0.0,0.0,Sauder School of Business to Close
0.0,0.268,0.732,0.8016,"Hope you had fun, Garden Partiers!"
0.0,1.0,0.0,0.0,So we know the 2 candidates running for VPAUA but do we know their Wu-tang Clan names?
0.336,0.5,0.164,-0.5267,Our activism on rape culture is meaningful | The Ubyssey
0.0,1.0,0.0,0.0,Admission Appeal
0.286,0.714,0.0,-0.25,The birb is camera shy today
0.0,1.0,0.0,0.0,200K or Study at UBC?
0.0,1.0,0.0,0.0,"International students deal with gaps left by CERB, CESB"
0.0,1.0,0.0,0.0,"[Academic] Bump to Baby! and Hey Baby! Couples’ Sexual Well-being Studies (Couples currently pregnant with their first child, or who just had their first baby up to 12 months ago, 18+, Fluent in English and living in the US or Canada)"
0.0,1.0,0.0,0.0,Transferring from UBC
0.0,1.0,0.0,0.0,REMINDER: It's time to renew your U-Pass! [December 2020]
0.482,0.518,0.0,-0.6792,"Ohh no, my camera broke! I can't use proctorio!"
0.0,1.0,0.0,0.0,UBC Courses Online This Fall???
0.0,1.0,0.0,0.0,The Tedx UBC videos are up on Youtube!
0.0,1.0,0.0,0.0,Average Grades in First Year (Science)
0.0,1.0,0.0,0.0,Smoke Everywhere! Especially in my dorm room!
0.0,0.598,0.402,0.4003,UBC Pride Parade - April 6th!
0.0,0.693,0.307,0.4767,Checking in with my Queer and Trans Friends
0.0,0.714,0.286,0.5859,UBC Free Speech Club invites white supremacist Stefan Molyneux to speak at Chan Centre
0.176,0.824,0.0,-0.4588,To the Rude Coughing Man Walking into my Personal Space exiting Brock Hall at 4pm
0.0,1.0,0.0,0.0,Asteroid on CS Department?
0.118,0.882,0.0,-0.1531,Anyone else observe Translink bus drivers on UBC routes being aggressive these days?
0.0,1.0,0.0,0.0,Is it possible to graduate in 3 years?
0.187,0.542,0.271,0.1027,Have I already ruined my chances of med school in the future?....plz help
0.0,1.0,0.0,0.0,Academic Recognition for first-year students
0.0,0.571,0.429,0.128,Feeling a little down/frustrated
0.0,0.683,0.317,0.6249,"Please, if we all email/voice our concerns about Covid safety to UBC administration"
0.0,1.0,0.0,0.0,Your Thunderbird Dance Team performing at the opening of the new bookstore to a Justin Timberlake Remix
0.026,0.833,0.141,0.7042,"Court Caldwell, a third year UBC English student, once ran for mayor of Vancouver. He felt so strongly about issues that he was willing to donate half his income ($96,000/year) to charities preventing youth from living on the streets"
0.0,1.0,0.0,0.0,Will an Intel chip be required to run the programs we need in Engineering?
0.204,0.796,0.0,-0.3182,60% of critical covid cases are fully vaccinated in Israel
0.459,0.541,0.0,-0.1779,UBC's  Harlem Shake 
0.0,1.0,0.0,0.0,Sign the Petition to Make the 41st Ave B-Line the #420 Bus
0.0,1.0,0.0,0.0,NEW Student Directed Seminar for 2020 - Hybrid Sexualities and Socialization!
0.0,1.0,0.0,0.0,AMA (PART 2) - MATH/CPSC/B+MM/TA/Worklearn/Co-op/Clubs!
0.0,0.755,0.245,0.0772,Some thoughts on mandatory vaccination
0.0,0.806,0.194,0.34,UBC to bring an LGBQ and Trans Pride installation to campus
0.457,0.543,0.0,-0.6195,CPSC 110 - Am I completely screwed? (Possible accidental cheating)
0.0,1.0,0.0,0.0,Attention SAUDER graduates of finance option
0.0,1.0,0.0,0.0,Covid and Campus
0.205,0.795,0.0,-0.4291,what do I do with a 50% final in a course that I am sooooooo lost???
0.0,0.83,0.17,0.5106,Is there any admitted students open house or events besides a campus tour that would be good to go to when visiting UBC Vancouver?
0.0,0.517,0.483,0.4215,Ubyssey campus safety interview
0.0,1.0,0.0,0.0,UBC is very *liberal-leaning
0.0,1.0,0.0,0.0,SIGN UP FOR A STUDENT DIRECTED SEMINAR - 2 are running this fall!
0.0,0.811,0.189,0.2732,do most work learn positions require interviews to be accepted?
0.0,1.0,0.0,0.0,How sustainability fits in with accessibility
0.0,0.702,0.298,0.4545,Accepted to International Economics | Vancouver School of Economics!!!
0.17,0.682,0.148,-0.1027,Why is UBC still accepting donations from an academic cheat (as per the FBI)?
0.0,1.0,0.0,0.0,"Yet another SRC exam entrance timelapse (10x). Apr. 16, 2019. Video ends at 15:31"
0.0,0.719,0.281,0.8232,None of my classmates like my engineering meme when I posted this in my first year so hoping the new first year engineers will like it
0.0,1.0,0.0,0.0,ubcprofs under maintenance
0.0,1.0,0.0,0.0,How should non-indigenous students get involved in indigenous advocacy?
0.0,1.0,0.0,0.0,"The Red Pill screening @ UBC – Friday, Feb. 17th"
0.0,0.755,0.245,0.3818,[AMA]: Riley Ty for AMS VP External and Senate
0.0,1.0,0.0,0.0,I Dare You To...
0.0,1.0,0.0,0.0,UBC students and Langara
0.258,0.508,0.233,-0.1531,TODAY 11:30 - 1:30: Help stop the death of 8 mature trees to build the Arts Student Centre
