"b'You want to throw mud, why not start with AirBnB which takes more short/long term rentals off the market, versus a University that actively is building residences repeatedly. \n\nI dunno what anyone has against gender neutral bathrooms though, usually you have a nice full stall with a door that closes without the customary 1/2"" gaps all the way around, and then you usually have a shared sink to clean up post business. I think this is a much better use of square footage, and a more private bathroom experience in general than gendered washrooms, and can\'t imagine why people wouldn\'t prefer that.'"
"b'Hi, I was holding that banner.\n\nDengists can fuck off.\n\nRead Democratic Confederalism \n\nhttps://www.google.com/url?q=http://ocalanbooks.com/downloads/EN-brochure_democratic-confederalism_2017.pdf&sa=U&ved=2ahUKEwimzN7-mIToAhVNsp4KHSMuBHgQFjAFegQIARAB&usg=AOvVaw1ZuOzHqg0jG5-fDakzJfOc'"
b'ITT: Daddy\xe2\x80\x99s kids getting their tuition + res paid off while they study at one of the most expensive post-secondary schools in Canada talking about the benefits of capitalism...\n\n\xf0\x9f\xa5\xb1'
"b""That's 2 words bro"""
"b"">They have taken these huge profits these students and have used none of these extra funds to increase student housing options on campus.\n\nIf you went to UBC in the 90s like me and remember what it looked like back then, and you compared it to what UBC looks like now, you'd see what a ridiculous comment this is."""
I LOVE UBC FOREVER
"b'Hopefully the top voted comments in this sub is a product of Reddit\xe2\x80\x99s user base rather than representative of the UBC population. \n\nThe people that say fk capitalism, doesn\xe2\x80\x99t understand that the underlying principles of capitalism is the recognization of the liberty of the individual. That\xe2\x80\x99s why democracy and free market capitalism go hand in hand. Does it solve every problem in that ever existed in the history of mankind? No, but it\xe2\x80\x99s the system that lifted billions out of poverty through the recognization of individual property rights.\n\nI also see people justify their \xe2\x80\x9cfk capitalism\xe2\x80\x9d stance with \xe2\x80\x9cI just want corps to be responsible\xe2\x80\x9d, and \xe2\x80\x9cfree college in Europe!!\xe2\x80\x9d... which is fine but they have no idea what\xe2\x80\x99s waiting on the other side of \xe2\x80\x9ccapitalism\xe2\x80\x9d.\n\nHonestly I blame the left leaning profs, who are the loudest with their opinions but never lives in communist socialist countries.'"
b'No one who praises communism has ever had family that has lived through it. Half of my family is Eastern European so I know how frustrating it can be to hear white North American liberals wearing AirPods praise communism without having the experience of family members dying and having to uproot their entire lives because of it.'
"b'Bro. Please stop. Let\'s ignore what you just said about covid being the ""deadliest disease of the millennia."" The one thing I hate about this reddit is that things can never be right. Somebody is always discontent with the status quo. Sorry, but your reddit post won\'t influence a University\'s teaching methods all that much. My advice: learn some social skills and adapt.'"
b'Eat burger and you will be fine?'
"b'Free Market =\\= Capitalism\n\nCentral Planning =\\= Socialism\n\nWhat separates them is who owns the means of production, everything else is optional'"
b'Yes but fuck capitalism though'
"b""Honestly, as an international transfer student I got stuck in not having housing for September till I finally got it but also being homeless this past month and a half and couch surfing at multiple places. But yet I believe this is not true. I lived here for a short period of time late last year and there was a lot of construction going on, in no time they've had multiple buildings built and allotted for students while continuing to build more.\nSure UBC loves the international student money but they also have that many applicants willing to spend it to come here. This is one of the best campuses and unlike York university and a lot of other places they actually invest a fair amount in providing to the students."""
b'[deleted]'
"b'Housing is a country wide problem, the federal government doesn\xe2\x80\x99t imposes a rent/sell price limit. landlords artificially increased price and salaries don\xe2\x80\x99t keep up. \n\nAnd lgbtq \xf0\x9f\x8f\xb3\xef\xb8\x8f\xe2\x80\x8d\xf0\x9f\x8c\x88 deserve be treated with respect and dignity have a bathroom for trans people is the minimal thing we can do for them'"
"b'You do know that domestic students also need housing, right?'"
