"b""so tell the university directly instead of complaining on here, instead of claiming that UBC (which provides the most student housing out of any university in Canada) is somehow responsible for Vancouver wide housing costs with no proof??? Not sure if you realize, but during the pandemic, non-Vancouver domestic students weren't moving here either, so stop blaming international students. UBC spent more than $600 million on student housing in the past 10ish years, and you're complaining about $6 million on gender neutral bathrooms?? You must be dumb as a brick. You know not only gender fluid people can use gender neutral bathrooms? They are called 'neutral' for a reason"""
"b""You're...confused"""
"b""Personally I can't learn anything with online and in person is how it is supposed to be. It's a bit of a rip of a bandaid to return but I know it'll be better in the long run"""
"b'That is based on a false dichotomy between capitalism and communism. Many of the ""fuck capitalism"" people want corporations held to account for their actions rather than fined pitiful amounts they can ignore, large and poorly behaved ones broken up, billionaires taxed significantly more, and the rights of the individual prioritized, for example by giving workers seats on boards. Oh, and eliminate some of the structures producing inequality, for example by making university free. \n\nIs this communism? No. It\'s already happened decades ago in the Western parts of Europe.'"
b'There\xe2\x80\x99s a girl in my class that always is shouting out answers and likes to banter with the prof during the class and she\xe2\x80\x99s so loud and I can\xe2\x80\x99t concentrate at all. I think I have adhd and have been trying to get diagnosed but currently I\xe2\x80\x99m not so I\xe2\x80\x99m just struggling a lot with no \xe2\x80\x9c\xe2\x80\x9dreason\xe2\x80\x9d\xe2\x80\x9d to be so confused in class. Idk what to do bc our classroom is small so no matter where I sit she\xe2\x80\x99ll always distract me and I barely understand what\xe2\x80\x99s going on in class when it\xe2\x80\x99s just my own brain distracting me nevertheless someone else being disruptive. I wish classes were hybrid so people who want online class can do them online and people who want in person could do it in person :/'
"b'China is so incredibly capitalist LMAO \n\nWhat a dangerously under-informed post. \n\nIt is not ""absurd"" to call capitalism evil -- it is a system that relies and thrives on exploitation, profit over people, endless extraction of not endless resources, the reduction of human worth to numerical value, and is responsible for widespread structural inequality, hopeless, and the impending climate crisis (my country of origin is built on sweatshop labor and actively sinking in case you don\'t think these claims are grounded in reality. Capitalism != democracy (under which rights to the freedom of speech do fall).\n\nYour family benefited from the same system that is built on and sustained by the suffering of millions and millions born to work hard and to no end. Of course they love it. ""The grind"" is a capitalist myth. Do you know the scores of underpaid, exploited, vulnerable laborers forced to work inhumane hours for less than a dollar a day? Sadly, it doesn\'t matter how hard you work. The borders you were born in and education you can access is intimately tied to the types of success available to you. The bubble of privilege is blinding. There is always time to learn. Please educate yourself -- after all, look at where you are.'"
"b""Once you graduate you'll realize that the world runs on basically one thing, money\n\nSure there are exceptions, but charities, non-profits, governments, schools, they like $$$"""
b'Please educate yourself on political ideologies before asserting that the only two ideologies that exist in the world are capitalism and communism'
"b'You can dress fascism up as communism, but in the end it\'s still a fascist, capitalism-fueled regime. Whether ""true"" communism will ever work is a totally different discussion.'"
"b"">Hi, I am not a poli sci major but\n\nBeing in political science doesn't validate their political beliefs."""
"I can’t take it anymore. Too many people, too many faces, I can’t focus and feel like I’m dying. Plus I have the constant fear that I’m going to contract the deadliest disease of the millennia so far.

I feel like there is no hope in sight. Walking down main mall freaks me out since I don’t know where to look. I end up looking at my shoes and bumping into people. And I know they all hate me. I wish we could go back to online."
"b'Maybe  they meant something else than Communism has an alternative.\n\nIt is pretty easy to imagine a society not driven by profits, bit by people happiness and care for our land. Anti growth movement eco d\xc3\xa9mocratie are rising. That could mean sometime forfeiting private property when the public need it, bit necessarily has a rule.\n\nWhat China is today is not a communist land. They are an incarnation of capitalism with the will to exploit has much as possible any ressources to own a maximum of the production mean. With the idea that wealth will trickle to the population...'"
"b""Mao's ghost is coming for youuuuuu!!!! \nBooOOooOOOo!!"""
b'Capitalism /= democracy. Communism /= authoritarianism.'
b'Your family should\xe2\x80\x99ve come to USA then \xf0\x9f\x87\xba\xf0\x9f\x87\xb8'
"b""> Capitalism is the reason why I attribute all my successes without being thrown into prison. \n\nI mean last time I checked, they don't throw people into prison for being successful in China. Jack Ma seems like he's very much a free man...\n\nI think you're conflating freedom of speech and freedom of expression with capitalism. They are not one and the same, and you can live in a socialist society with freedom of speech, and live in a capitalist society without, and it's not contradictory for either state to exist.\n\nPeople dislike capitalism in Canada because while it may not be politically oppressive, it is economically oppressive to live in a society that demands that ties a person's ability to work with basic necessities like food and housing. Vancouver in particular is suffering from massive housing and opioid crises that can be directly linked back to our inability to provide housing and healthcare to those who need it, and the attitudes that prevent social housing and full, universal healthcare stem from attitudes that people have about capitalism."""
b'I feel bad for science students who get their labs cancelled. How are you supposed to learn hands on skills by watching someone else do it on a video'
"b'I mean, common use of ""fuck capitalism"" means ""fuck late stage capitalism"". \n\nEven the leftiest of US political candidates isn\'t out here trying to to destroy capitalism. But there sure is a restructuring that needs to happen. So like yeah, in it\'s current state, fuck capitalism.'"
b'UBC subreddit is like a ring with Extroverts fighting Introverts'
b'Stockholm syndrome much? How do you expect to ever function in the real world? May help you to look at actual risk by age.'
"b'This is such a stupid post. \xe2\x80\x9cIf you work hard you\xe2\x80\x99ll be successful\xe2\x80\x9d is the biggest lie capitalism tells us! Poor and middle class people spend their lives working hard but still never progress financially or become \xe2\x80\x9csuccessful\xe2\x80\x9d. Late-stage capitalism helps the rich get richer and the poor poorer, it all but destroyed the middle class. The vast majority of us are closer to being homeless than we are to being rich or \xe2\x80\x9csuccessful\xe2\x80\x9d. \n\nAlso just because someone says \xe2\x80\x9cfuck capitalism\xe2\x80\x9d does not mean they are pro communism.'"
b'Maybe you should try taking some political science classes.'
"b""I can understand where you come from when you describe the terrible housing situation (being an international student myself) that exists in both Uni's but I would really appreciate if you wouldn't shit on Uni's creating gender neutral bathrooms which at this point for many non binary individuals (including myself) is necessary. You can never completely understand or even know how it feels to share a washroom with a bunch of guys stinking of testosterone and giving you THE GLANCE as if you don't belong there. So yeah next you wanna go on a rant atleast try to be a bit more respectful."""
"b""I just tape my eyes closed when I walk down main mall. Makes it so I can't even look if I tried. Helps"""
b'Some y\xe2\x80\x99all don\xe2\x80\x99t get the joke \xf0\x9f\x98\xac\xf0\x9f\x98\xac\xf0\x9f\x98\x82'
"b'Capitalism and Communism can mean SO many things, and they are not necessarily antonyms. It\xe2\x80\x99s not communism that your parents ran away from, it\xe2\x80\x99s authoritarianism. And it\xe2\x80\x99s not capitalism which made your fate different, it\xe2\x80\x99s civil rights and democracy. I\xe2\x80\x99m from mainland China, and yes it\xe2\x80\x99s that weird form of capitalism in China right now that gave me the privilege to study here, yet I\xe2\x80\x99m totally not proud of it but kind of ashamed of this fact. I\xe2\x80\x99m surprised that anyone would actually thank capitalism for providing them with privileges. I recognize the privileges that capitalism gave me, so I feel the responsibility to learn more and hopefully help end the authoritarianism in mainland. The PRC style capitalism is currently merging with censorship and totalitarianism; freedom in mainland China is suppressed by this evil combination. So in that sense, as a Chinese, I would say, yes, fuck capitalism. I feel guilty for being privileged, and that\xe2\x80\x99s why I study so that I may be able make a change.'"
"b'Have taken some history, political science classes both in the states and China. My impression is that both countries run on capitalism without proper government oversights or regulations. In US, rich people buy politicians. In China, rich people own the government.'"
"b""There are more anti-capitalist options than Lenin-inspired state-capitalism, it's not one or the other."""
b'Love the comments section man...'
"b'> Yes, they love capitalism   \n>  \n> Capitalism is the reason why I attribute all my successes without being thrown into prison \n\nHi there, I am also from mainland China. Ever since Hong Kong, there has been a lot of discussion within both sides, but hardly any real civil conversation between both sides. I don\'t want to change anybody\'s mind or argue or offend anyone, but I just want to share my thought.\n\nI just don\'t think you are right. To say you love capitalism sounds just as absurd to me as to say you love communism. Both can be malicious and have caused immense sufferings. \n\n> Capitalism is the reason why I attribute all my successes without being thrown into prison. \n\nUnless you are wanted in China, that is a big claim to say. I\'m not saying you\'re lying, unless you had a wildly different experience in China than **majority** of us.\n\n&#x200B;\n\nI understand where the hatred towards the Chinese government is coming from, but being someone who can see both sides, I can confidently say the west, especially reddit, is quite blinded. I do love my country, but doesn\'t mean I am ""brainwashed"". It is just sad to see these attack on my country, just because we don\'t have a powerful media like the west.\n\n&#x200B;\n\nI\'ve been following these debates a lot since Hong Kong, and this is my first time posting anything related online. Its pathetic to see political debates always end up everyone hating on each other. But if anyone is interested, I\'d love to talk about it.'"
b'deadliest disease bruh.'
b'/r/UBC tries to spot satire/troll challenge IMPOSSIBLE GONE WRONG GONE SEXUAL'
b're-entry is hard.'
b'this is so dumb.'
b'Lmao this post is such nonsense. Imagine thinking that capitalism is the opposite of authoritarianism.'
b'In your age range your chances of dying of covid especially if you are vaccinated is virtually 0% so thinking about it as the deadliest virus of the millennia gives the false impression of symmetrical risk. So be safe and don\xe2\x80\x99t worry too much.'
"b""Not this bullshit again.  \n\n* Bathroom renovations don't come out of the housing budget\n* UBC isn't responsible for the Canada-wide housing crisis or for Vancouver being one of the affordable housing markets in the world\n* UBC is building new student housing all the time\n* UBC isn't responsible for a significant number of university students throughout the country being food insecure\n\nI'd also like to see your sources for the claim that the presence of international students is directly responsible for the high cost of housing in this city."""
"b""UBC is building a lot of student housing. It's just that UBC students are competing with students from Langara, BCIT, Douglas, and all the other scam downtown colleges that are also looking for housing in Vancouver. ONLY UBC and SFU is building ANY student housing. \n\nNo other college is in Vancouver is doing anything except accept more international students making this housing crisis worse for everyone involved"""
b'That sucks.  But this is real life. You gotta learn to get past this fears.'
b'Ebola is back? Damn I missed the memo!'
"b'It\xe2\x80\x99s actually not true that UBC makes more money off international students. The international students themselves pay more for tuition, but that\xe2\x80\x99s because the government subsidizes the tuition for domestic students. At the end UBC still receives the same regardless of international or domestic.'"
b'University doesnt make smart students anymore'
b'check out Naomi Klein\xe2\x80\x99s new book for what\xe2\x80\x99s wrong with capitalism. I\xe2\x80\x99m happy you\xe2\x80\x99re parents and you have gotten away from the imperialist dictator that is China.'
In person sucks!
b'I just saw a post on the UBC housing Facebook group for somebody who got on campus accomodation and is renting it out for the full year... FOR A PROFIT. How the fuck is this happening??'
b'Communism has much more in common with late stage capitalism than it does with democratic socialism. You do not have your definitions straight homie.'
"b""Yah, fuck some capitalism, also maybe like stop personally associating yourself with capitalism? That won't do you any favors."""
b'Idk if this is a joke but I do find in-person exhausting sometimes'
b'Dawg I completely agree!! It\xe2\x80\x99s these rich North American kids whose entire livelihood and parents wealth have propped them up so comfortably to be able to spend all their time at reading the communist manifesto in front of the nest and refusing to work for \xe2\x80\x9cthe system\xe2\x80\x9d.'
"b""Dumb post imo. All for UBC putting more effort into addressing the housing issue, but this is a weird way of doing it.\n\nIt's not just international students, out of province/city students can cause problems (although imo as an OOP student we get a little bit of the short end of the stick, as we absolutely need housing in Vancouver, but may not have the housing guarantees a lot of international students may have due to scholarships)\n\nWhile UBC may have some responsibility, I'd say the government has a larger role in it. \n\nFirst off a lot of these issues could be solved with better transit to UBC. A commute from Burnaby wouldn't be all that bad if we had a SkyTrain line to UBC already. \n\nNext UBC accepting too many students in general, especially with the fact that first years are gaurenteed housing if they want it, which creates a bit if a false sense of security. Mind you a lot of this is particularly bad this year due to pandemic HS grade inflation, students who delayed their admission due to lockdown, etc. \n\nUBC also needs more land and money for housing (i.e. some of that property in West point Grey) this issue is twofold because housing is so expensive to build that UBC allows private developers who charge Insane rent to build on campus, which can help in short term but cause problems for students not super wealthy as it takes up prime campus real estate with unaffordable luxury apartments, which is already kind of limited. Hell I'd say at this point finding a way to build closer too or on the endge of Pacific spirt park might not be the worst idea in the world. But that's kinda a last ditch measure as it's kind of important as a conservation and research area. Plus it's just beautiful.\n\nLastly the style of housing needs to change a little i think. Sure full apartments with kitchens and bathrooms etc are wonderful and it's cool that UBC has student housing like that, but that's kind of rare and not the norm for a lot of schools. Upper year Dorm style housing with shared bathrooms, kitchens and lounges, less restrictions on personal cooking items like induction stoves would help a lot.  Students may not like this but the reality is this is how student housing is done nearly everywhere, and is one of the reasons many schools abroad even in places with housing crises usually can house most if not all of the students who want or need it. \n\nThis is because it creates incentive for students with the means to live off campus or in private housing to do so (i.e. those loaded international students you're angry about) as it you can get things student housing can't get you like some privacy, versatility and/or luxury, which naturally lowers demand for student housing.\n\nI.e. it avoids situations like the one at UBC where unless you're absolutely loaded, student housing is just by far the nicest and best deal for housing you can get, and you'd be stupid to not put your name on the list as chances are even if you don't want it you can sublet under the table it to someone who does, As it's basically just a nice apartment for the cheapest rent you can find in a 10km radius\n\nAnyways rant over time to crawl back into the closet I'm renting for 700$ a month. Kind of a steal IMO."""
"b""It is very clear you're not a poli sci major considering you don't know what you're talking about."""
"b'Ok so UVIC and SFU have already had student led walkouts asking for hybrid learning options. If some of you guys are feeling this way, you aren\xe2\x80\x99t alone! Let\xe2\x80\x99s get together and rally for the PHO to recommend remote and in-person for everyone\xe2\x80\x99s peace of mind.'"
"b""UBC is literally constantly building up housing. Just in the time that I've been at UBC they've put up Exchange, Saltwater, and now Brock Commons Phase 2 is nearing completion - all multistory, high density housing. And in that time the number of students attending UBC had not changed significantly as far as I know. So UBC has definitely taken some students off the market yet the cost of housing keeps going up. Though I do believe UBC should do what it can to make housing more affordable for students, and it's very likely that it could and should do more, it isn't really the source of the problem. Also, only just over a third of students at UBC are international students. Two thirds are domestic students, and not all of them are from the lower mainland. And even those that are don't all live with their parents. Domestic students have to live somewhere too, but OP only points the finger at international students."""
b'bro is acting like catching covid means u have stage 8 brain cancer'
"b""Covid or not I feel like going forward all classes should be hybrid. Not sometimes in person and sometimes online but having the ability to stream in live vs watching recordings.\n\nThe infrastructure is already there. I wouldn't expect the profs to reply to any of the online / zoom chat but I would like the choice of being able to just zoom in if I felt like it.\n\nThe profs could just treat it like fully in person but if you prefer the online route then the option is there for you. \n\nTests, labs, exams, still all in person though. I wouldn't expect the profs to go above and beyond to accommodate the online watchers aside from just starting / stopping the zoom stream."""
"b'I think people have the right to critique and express their frustration with capitalism. For all it\xe2\x80\x99s benefits, it has also brought negative effects. Do I agree with how they expressed it? No.'"
b'Same. SAME. In person actually made me skip class more!'
"b'Yeah expanding on-campus housing has been a decades long initiative for UBC.\n\nUBC has invested more than half a billion dollars and increased capacity for 5000+ students over the last decade - multiple dense, high-rise complexes along with renovations to nearly all legacy residences. Plans are in place to add an additional 18,000 spots.\n\nhttps://news.ubc.ca/2018/08/22/ubc-student-housing-facts-and-figures/\n\nThat\xe2\x80\x99s in addition to the $70 million land purchase in Surrey last year for the UBC satellite campus for 10,000 students.\n\nSo\xe2\x80\xa6 I don\xe2\x80\x99t think it would be an accurate to say UBC is sitting on their laurels with this issue, considering they are the largest provider of subsidized, student housing in Canada and among the biggest in North America.\n\nAnd I would like to phrase this in as constructive criticism - while you repeatedly try not to blame international students, I feel like you are in fact pointing the finger at them for Canada\xe2\x80\x99s housing fiasco. I clarified in a [past post ](https://www.reddit.com/r/vancouver/comments/avotan/redditor_falsely_uses_canada_stats_to_claim_intl/?utm_source=share&utm_medium=ios_app&utm_name=iossmf)that the number of study permits for the region has not really relatively surged over the past decade when taking into consideration the rate of sharply rising housing prices and the some 30,000 people who move into Vancouver each year.'"
b'China is capitalist.'
b'***Ebola and the Black Plague have entered the chat***'
"b""I can't pay attention online, since we went back in person I've been doing very well in class. I have ADHD though and need to seperate where I do work from home to be productive."""
b'This is satire right'
b'Therapy'
"This is not a commentary against international students. Universities should always be a place to exchange ideas with people from different backgrounds

&#x200B;

In saying that, both schools continue to invite international students over because they can charge them 4x the tuition. They have taken these huge profits these students and have used none of these extra funds to increase student housing options on campus.

&#x200B;

Housing costs actually went down during the 2020 pandemic, and a lot of that had to do with the lack of international students to the lower mainland. This again is not the fault of international students, it's just the simple fact that supply was actually meeting demand and benefited the consumer.

&#x200B;

Both schools know full well that the international students they are inviting to our area is impacting housing demand, and neither has done anything to build more housing. Both exist in a space where they can build more housing and expiated pace compared to municipalities and both are doing shit all

&#x200B;

Again, not a commentary on international students existence in this space, but a critique of how both universities are letting us starve because they refuse to use the profits they get from inviting students to this region to build more student housing. But the good news is, they committed $6m to changing brand new bathrooms into gender neutral ones, despite less than 1% of the student body identify as ""gender fluid"""
"b'>less than 1% of the student body identity as ""gender fluid""\n\nThen why, as a heterosexual person, do you have a gender neutral bathroom in your house OP?'"
b'Fuck unchecked capitalism'
"b'So, do you spend your entire life indoors? I get being nervous from catching rona, despite your claim of it being""the deadliest virus of the millennia"" which is just absurd! As for social anxiety, a lot of us have developed it to some degree after staying at home for 2 years. BUT this is life... It\'s not gonna happen at your desk, it happens out there where people are at.'"
"b'Well fuck rampant unchecked capitalism. I dont think most reasonable people want full on socialism or communism..but hey go ahead and be terrified it is after all, your right to feel however you want.'"
b'What is in China isn\xe2\x80\x99t communism tho. They say it is but it\xe2\x80\x99s not. Also the people claiming fuck capitalism are referring to the fact that capitalism inherently is infinite growth and capital on a finite planet. A business will always choose profit over their employees rights or well being unless it\xe2\x80\x99s law and always choose profit over the environment which is why we\xe2\x80\x99re in a climate emergency. Communism isn\xe2\x80\x99t the answer however redistributed wealth and publicly owned business is the answer'
b'\xe2\x80\xa6deadliest disease of the millennium so far?\n\nLol. This post is peak r/ubc.'
b'The fact that so many people fell for this post \xf0\x9f\x98\x82'
"b'\xe2\x80\x9cjust clarifying i am NOT xenophobic. i am NOT being xenophobic, ok?\n\ni will be a little transphobic though\xe2\x80\x9d'"
b'Are u in BIE?'
b'Tbh i actually think this is a joke and you\xe2\x80\x99re doing a great job trolling people'
b'[removed]'
"b""Ngl but this comment section proves that you didn't do your research bro."""
b'The people who benefited from capitalism and escaped their fellow suffering countrymen love it.\n\nWho knew!'
b'Not every individual of a species can adapt when the environment changes. Adapt to it or you get wiped out.'
Both SFU and UBC Need To Take SOME Responsibility For The Housing Issues
b'you did not do your research\xe2\x80\xa6'
b'I can\xe2\x80\x99t even hold my pencil properly in class from shaking in terror. Glad someone else agrees with me.'
b'r/communism would disagree with you.'
