0.0,0.0,0.0,0.0,
0.099,0.762,0.139,0.9633,"Now I know it's not just AUS, student bodies like The Ubyssey also supports FIFA with their recent article about where to watch the matches. 

But as an arts student, I'll just speak on AUS for now. They have been advertising on their IG about an event to watch one of the games this week, and idk...it just feels super juxtaposed to what I thought the AUS stood for.

Now look, I know people love football/soccer, and will watch regardless. I get it. But it just seems extremely strange for the leaders of our student body to support FIFA Qatar, after all, they (AUS) constantly make it known they care about human rights and justices. But I guess they were just pretending? 

For anyone that doesn't know, the stadium was made by borderline slave labour. Many deaths, no pay, and being held hostage (not allowed to leave, passports taken away etc).
On top of that, they, and other fifa workers, and visitors have reported assaults and r*pes committed by airport security, police, and those in positions in power. 

So, I was curious for their reasoning  and contacted AUS. This was the response I recieved from the AUS VP Student Life (despite being public, not sure if im allowed to put their name due to reddit rules?)  :

"" Thank you for bringing up this concern. We will be prioritizing time at our event to address the human rights abuses in Qatar by making a disclaimer and announcement at the beginning"".

 Now, I'm not angry with this response, and whether or not they actually do that, who knows as I won't be attending because I refuse to support. But, why host this event at all? And I still wasn't really given a reason as to why host a viewing of an event built upon slavery and other human right abuses.

And before anyone says ""FIFA has always been corrupt, why are you just now speaking up?"".
I'm a soccer player and have actually always been against FIFA due to their corruption and problems they cause in the countries they go to. This is my first year at UBC (transferred over), so this is my first time experiencing a student body that's fine with FIFA. So that's why I'm speaking on it now.

I know in the end some people will care, others won't. But it feels gross that our student body would actively support it. It's different than the average student going home and watching. This is our elected student body. I hate that now I know, any future social justice, or human rights support campaigns they put out are just lies so they can get votes. They don't actually care."
0.0,0.571,0.429,0.4588,UBC UAS is recruiting :)
0.0,0.79,0.21,0.8271,"Does anyone know if there’s anywhere closer to the where classes r held that sell cigs? I know the prime C-news store and the university pharmacy do, but they’re a bit far. Thanks <3"
0.0,0.61,0.39,0.8074,Does anyone know if the UBC urgent care centre is free for students? I need a dermatologist referral.
0.102,0.845,0.053,-0.9802,"This post might get long but I’m going to try to give the full story as I feel like my situation may cause this to be a possibility. 

In September 2019 I had to take a language class as I was in the arts program and it’s a requirement. This requirement is about the only thing in the degree that I was really dreading to do. I have always had difficulty learning languages. I come from a bilingual family and only know one language. I also had issues with language courses in school. 

I am a student with a disability and registered through the Centre for Accessibility. At the beginning of the semester I met with an advisor there and talked to her about the fact that I’ve had difficulty learning languages and I feel like it’s due to my disability. She said that my disability did not qualify for a language exemption. I could either go through a 6-8 month process of psychoanalysis that would show if I have a difficulty or take the course, show I have a difficulty, and then get an exemption. Since I needed to start taking the language courses that semester to fit my graduation schedule I decided to just take the course as the psychoanalysis took too long to help. 

About a month or so after I learned that I could take the language course for credit/fail. I didn’t know this was the case because it was a required course. By the time I learned this it was about a week after the withdrawal date. I emailed an advisor and explained the situation to see if I could get it switched to credit/fail so my GPA wouldn’t be effected but they said there was nothing they could do. I feel like this was kind of shitty as I went to an advisor expressing my difficulties and they never advised me to take it for credit/fail even though they knew I had concerns of me failing the course and affecting my GPA. I understand there’s some personal responsibility here but I just didn’t know this was an option. 

Fast forward to the end of the semester and I failed the course. The next semester I took it again for credit/fail and passed. However, I knew if I had to take the next course I’d fail as I knew I barely passed. 

I contacted the same advisors at the Centre for Accessibility and went through a process and was given a language exemption as I proved a difficulty learning languages. 

My question is, can I get this fail of the language course removed? As I didn’t need to take the language course for my degree, I have proven a difficulty learning languages, I wasn’t advised properly and could have taken it for credit/fail where it didn’t effect my GPA. 

Any answers are greatly appreciated. Also if you know who I should contact about this please let me know."
0.0,1.0,0.0,0.0,Silent Mechanical Keyboards for Tests/Exams
0.108,0.786,0.106,-0.6273,"The word BIPOC makes absolutely no sense to me in a Canadian context. I don't intend to step on any toes but the use of the word feels like a lazy export of US issues and vocab to a Canadian context. ~~Black people have historically been a tiny minority of the country(\~1 ish%) and haven't faced the same systemic barriers that they did in the US (like Jim Crow laws)~~ *~~to my knowledge~~*~~. While American attitudes certainly hop the border, I really don't think that black people have the same ""place""   in society in Canada(3.5% of pop) than the US(13.4%) . Furthermore, a large % of black Canadians are recent immigrants(52%), so have not had the historical burden of racism in Canada in the same way as the black Americans(in my view). As an example, Chinese Canadians make up 5.1% of the population and were subject to things like the head tax/non citizenship. Heres a quote from a report Wilfred Laurier commissioned about Chinese Canadians: ""\[Chinese Canadians are\] unfit for full citizenship ... obnoxious to a free community and dangerous to the state."" Why are East Asian Canadian issues not forefront when they make up such a large portion of the population and have been subject to historical racism?~~

EDIT: ok maybe ""place"" was a bad word choice. Would position be better? visibility? idk. Also a comment gave me some more context to historical racism in Canada against black people, so thats why thats crossed out. ~~I also didn't intend the chinese canadian point as a comparison of ""oppression"" I just meant it as a population comparison to another racial group that is significantly larger as a total share of Canada's population. My logic goes something like: The larger a current/historical population within Canada is the more people are affected by marginalization.~~

EDIT 2: Ok yeah, the comparison to Chinese Canadians definitely could have been done better. u/Giant_Anteaters said it really well.  The term BIPOC essentially forces me to make a racial comparison of oppression, which I disagree with.

EDIT 3: to clarify, I'm using population because thats a clear indicator of how visible a group is in general society.

I also don't understand the intention of the word. POC already includes black and indigenous people, so the BI- is redundant. POC really just means ""non white"" so why make the distinction? POC implies that white people are somehow different to everyone else which feels racist to me.

I also take issue with the ""POC"" part. I'm not a ""person of colour"", I'm a person. If someone called me a person of colour to my face I would take serious issue with it. The reduction of my identity to not even a racial group, but only as ""person of colour"" is so deeply uncomfortable to me for reasons I struggle to really put into words

I'm not saying that black people don't face racism in Canada, I'm just saying that I don't see the historical/cultural significance that black people have in America mirrored in Canada.

This is a throwaway cause I'm not trying to get cancelled.

Heres a link of UBC using the word BIPOC just for proof: [https://news.ubc.ca/tag/bipoc/](https://news.ubc.ca/tag/bipoc/)

Please engage in good faith."
0.128,0.81,0.062,-0.7874,"Small issue I know, but during my exam yesterday I found the hot dry hair to be very uncomfortable and even somewhat distracting. I tried drinking a lot of water to combat the sore throat (wasn't sick at all beforehand), and ended up having to use the washroom twice from drinking so much water. Wasn't an issue yesterday b/c that exam wasn't tight on time, but I'm worried about other exams I'm writing being tight on time and thus not being able to finish I were to use the washroom.

Anyone else feel the same way or have suggestions that do not involve purchasing a portable humidifier? Thanks in advance"
0.583,0.417,0.0,-0.4199,In person sucks!
0.0,0.933,0.067,0.2406,"I need a break from Vancouver. I want to return in January and study until April, but in the meantime, I want to go study elsewhere for the fall term. For reference, I'm studying engineering. How can I do this? Suggestions? East Coast in the USA is preferable."
0.0,1.0,0.0,0.0,Did you ever think highly of yourself because you go to UBC and slightly look down on other colleges and schools?
0.0,1.0,0.0,0.0,Posting about exam sickness
0.0,1.0,0.0,0.0,(Inspired by UIUC): What's your body count so far at university?
0.348,0.652,0.0,-0.7876,What is the point of wasting trees on this shit there is one every step
0.0,1.0,0.0,0.0,Can candidates give candy to voters?
0.465,0.233,0.302,-0.1779,pls cancel classes🤞
0.12,0.802,0.078,-0.6476,"If you are considering applying for Co-op, don't.

1. They had 1 workshop which was absolutely useless and added no value to my search
2. Their job postins are mostly minimun wage and very bad positions
3. I secured a job out of their job postings and they are asking me to pay them 800$ simply because I am part of the program. (Even though I did everything alone)
4. International students get way fewer positions available for them. Most of the posts on their job board were for domestic students only.

If you got in, drop out. If you want to apply, don't. You are better off doing it on your own for free."
0.077,0.781,0.142,0.6587,"By having you guys not studying for the finals, the class average will be lower and my mark will get scaled up more. I really appreciate that.

yours faithfully,

A guy who spent that night studying instead.

Edit: seeing the disagreement in the replies is really reassuring. So thank you all. Good luck and good hunting on the exams

Edit2: And this is exactly how I got 28% above class average back in first yr math, you guys probably don't like the way it sounds but I like the way it works."
0.189,0.811,0.0,-0.3612,UBC research: Lower vaccination rates among people who use drugs could lead to serious outcomes from COVID-19
0.0,1.0,0.0,0.0,Where to buy Android phones from?
0.0,1.0,0.0,0.0,My biggest gripe about being a CS student...
0.011,0.837,0.152,0.985,"👑 Welcome to cmd-f 2022: British Columbia’s largest all-women\* and gender minority hackathon! 👑

💫 Register here: [https://cmd-f.nwplus.io/](https://cmd-f.nwplus.io/) 💫

✨ March 5-6th 2022, Virtual Hackathon ✨

See more information on our Facebook event: [https://fb.me/e/XtTf214Y](https://fb.me/e/XtTf214Y)

👑 **ABOUT CMD-F** 👑

cmd-f is a weekend-long virtual hackathon designed as a safe space for women\* and gender minorities interested in gaining new skills, building overall confidence, and discovering supportive communities. We want to support YOU, regardless of your background or experiences, in getting well-acquainted with the local tech industry here in Vancouver BC (where we are based) and beyond! To help encourage learning and project creation, there will be a donation to a charity for each project submitted!

✨ **HACKER REGISTRATIONS CLOSE MARCH 2ND, 11:59 PM PST** ✨

We can’t wait to see you at our sponsor booths, workshops, keynote panel featuring women\* in tech, and mini-activities at cmd-f. Whether you're new to coding, a seasoned hacker, or simply looking to get a glimpse into the tech world, we want to help you take your next steps.

\* We acknowledge that ""women"" is not an accurate description for many people, and it may make some feel unwelcome. We use \* to specifically and intentionally include cis and trans women, as well as women-identifying non-binary, agender, or intersex people and other gender minorities. This event is completely beginner-friendly and is open to women-identifying post-secondary, high school students, and recent graduates (within one year of graduation) from all schools and backgrounds."
0.0,0.323,0.677,0.6369,Best night clubs
0.0,1.0,0.0,0.0,"I have a custom mechanical keyboard with silent switches (Boba U4s), and they sound as loud as a regular laptop keyboards. Would I still be able to use it during online exams that I take in class?"
0.0,1.0,0.0,0.0,"Black students, do you feel you belong at UBC and Vancouver in general?"
0.092,0.836,0.073,-0.0116,I’ve skipped all of them so far and we have iClickers😭 I feel so bad bc I live on campus and don’t have to commute or anything but it’s just so hard to wake up in the morning and be motivated to go to class. How do you guys do it?
0.059,0.873,0.068,0.1306,ive taken multiple courses that involved piazza but i never understood how anything works on this app. like is it anonymous Or is it not? why not just use canvass discussions? i genuinely do not understand why someone would choose to implement this app for their course 💀💀 just a rant
0.0,1.0,0.0,0.0,UBC experts on 25th anniversary of Hong Kong handover
0.106,0.894,0.0,-0.3612,Most sites including the one for the airline says the flight is on time but a few say it’s cancelled. How do I know?
0.0,1.0,0.0,0.0,K-wave showcase
0.434,0.566,0.0,-0.3182,Why ya’ll ghost me
0.0,0.874,0.126,0.0772,"🙁

Ubc pls dont tell us to wait for 6.30 again"
0.054,0.824,0.122,0.8481,"This is a dangerous habit. For people like me who skate and bike between classes, we tried to be as careful as possible. Still, on my way from one class to another there's always a few person I skate by that are looking down their phone and walking erratically. Like gas particles doing brownian motion. 

With the street being too crowdy to go around, best I could do is to slow down to fast-walking speed, slowly pass by them and pray to god that they won't suddenly make a 90 deg turn and ram into me. With all attention on their phone, they are almost blind, deaf and disoriented at the same time. 

Fortunately I was slow enough that I never actually collided with them, most of the time is a push or near miss that somewhat surprises them. 

If you wanna use your phone for urgent matter, just move to the side of the road and stand still. The ""don't text and drive"" applies to walking as well."
0.0,1.0,0.0,0.0,"

[View Poll](https://www.reddit.com/poll/yl5r4m)"
0.143,0.825,0.032,-0.6604,"Was told deadline was last Friday.  Made my decision and sent request on Friday around noon.

Rejected: too close to deadline. 

UBC, pls post the deadline *for submitting requests*. Anything else is not useful to me 🙏"
0.108,0.736,0.156,0.2748,"I’m a second year student wanting to get into grad school for psych. My average this term is fucking awful. My overall average for everything is only 70. Idk what to do. What are my chances? 

Please help."
0.044,0.936,0.02,-0.3195,"Does anyone else think that term 2 should be totally online even after 24th Jan with the new flurona ( Influenza and Corona mutation) that was just discovered in Israel? I personally don't feel safe going into classes anymore. Its not long that flurona will reach Canada and us, international need to make plans way ahead"
0.134,0.77,0.096,-0.7737,"Let me preface this by saying I am a hater first and a person second<3

The acapella club karaoke booth in the Nest is even more annoying and ineffective than Neo Financial. You are NOT the Barden Bellas and you are NOT Pentatonix (whom ALL holiday retail workers have grown to despise). Like be fucking for real babes.
Apparently this public karaoke is their way of selling tickets for their winter showcase?? I’m not a marketing major but I feel like forcing everyone in the vicinity to listen to your mid (at best) singing is a surefire way to NOT get people to PAY to come to your show. No one wants to pay hear you sing! The only people coming to your show are your poor friends and family who you BULLIED into paying to watch you sing because your fragile little Tinkerbell egos need applause to live. Y’all need to get over your main character syndrome"
0.0,0.678,0.322,0.2263,Is joining a sorority worth it?
0.125,0.739,0.136,0.1154,"My first culture shock is being ghost by 2 girls I like the most, I am not that bad tho. I just happened to know it’s a trend here (from one of my prof), Why ya’ll do ittttt"
0.167,0.606,0.227,0.2003,I can’t stop staring at this hunk of a bus driver. Help!
0.0,1.0,0.0,0.0,Is there a decent balance in terms of race ?
0.333,0.667,0.0,-0.6705,I blame everyone crying about wanting online finals in December for January online classes
0.0,1.0,0.0,0.0,Any idea when we will know whether classes will remain online?
0.182,0.455,0.364,0.296,I swear ubc secure is bipolar
0.0,1.0,0.0,0.0,I’ll see myself out.
0.159,0.768,0.073,-0.9184,"It really confuses me how the same group of people who were adamant that school went online for the last 3 days of exams are now getting upset at the school for ring extra cautious and extending the restriction. We’re you just on the side of going online so you could cheat on your exams while having rampant parties in person or just because everyone else was? 

I know quite a few people who share the same thought that it’s because you guys fought so hard for those 3 days that UBC can justify going online and just extending it “to be safe”. Realistically we all know UBC is just gonna try and milk our money and get us in person for March so they can justify all the ridiculous building and administration fees, whilst upholding truly overpriced online education. 

You all who fought so hard for those 3 days with your rants, anger and strikes now get the reward of never ending online school to keep your calls for safety to be verified."
0.0,1.0,0.0,0.0,HOW DO YOU GET AN A IN ASSIGNMENTS
0.385,0.615,0.0,-0.3612,UBC SUCKS AT DECISION MAKING
0.0,0.762,0.238,0.3612,New scholarship program supports Black Canadian students at UBC
0.0,0.789,0.211,0.8243,Is it just Christmas that food places near campus are like all closed or will more open up like at the village not run by UBC Food Services? I hope I am not stuck with Big Macs and fried chicken all break.
0.0,1.0,0.0,0.0,Could someone make a list of all the clubs and their meeting times on club day?
0.0,1.0,0.0,0.0,Cheap groceries around campus?
0.135,0.752,0.113,-0.4997,"This might be a bad take, but:

If you are sick and have an upcoming exam, why are you telling everyone on Reddit about the exact exam? Whether you go write it or not (there is nothing stopping you), why do you have to warn everyone... Luckily I haven't seen any posts about exams that I have been a part of yet. Even if there are people in my exam with covid, I don't wanna know about it**😂.** I just feel like everyone should be prepared for the worst at this point"
0.0,1.0,0.0,0.0,Why does UBC/Canada use the word BIPOC?
0.0,1.0,0.0,0.0,Bob Odenkirk
0.0,0.68,0.32,0.5106,This election 🗳 has been fun to watch 🤣🤣🤣🤣🤣
0.0,0.84,0.16,0.7263,"Does anyone know any locations/buildings or rooms on campus to hold an event for 200 people? Even better if it has or provides equipment to stream the event, projector and screen, microphones, etc. Thanks!"
0.0,1.0,0.0,0.0,Just did my first lab interview
0.0,1.0,0.0,0.0,to the girly in cpsc 121 102 today who kept coughing without a mask
0.392,0.405,0.203,-0.34,Are you also feeling intimidated ?
0.041,0.858,0.101,0.8577,"UBC claims there are 9800 faculty, staff, and students not yet in compliance (that's a lot) from the last Senate meeting. What will happen on Tuesday will be interesting.

&#x200B;

Have you watched the senate hearings during this issue (specifically Dec 15 2021)? Some observations include:

* fear/politically expedient policy making
* lack of vigorous discussion from multiple senators
* lack of legal considerations

Are you aware of PIPA in BC and any complications associated with it?

* specifically section 7

Are you aware of Bill S-201 and how testing is related?

Are you aware of the elimination of Proctorio from UBC due to privacy concerns (but then openly sharing your personal information with third parties - i.e. Thrive Health)?

Have you noticed the underhanded inclusion of consent on the declaration forms?

&#x200B;

&#x200B;

&#x200B;

Can you rationalize the viewpoint of the opposing side without straw-manning the opposing argument.

Interested to hear some differing opinions.

Please provide some reasoning to your position and clarify your thoughts."
0.524,0.476,0.0,-0.6597,I think I’ve fucked up everything
0.059,0.762,0.178,0.8122,I miss the days when it would rain (or just be cloudy) where I could wear a nice jacket and cozy up with hot chocolate. Unpopular opinion but rainy/not sunny days are so nice! Last year we had so much rain by this time… and I miss it. Climate change….
0.0,1.0,0.0,0.0,why do we wear regalia at graduation ceremony?
0.0,0.87,0.13,0.0516,Does anyone have video of Manila grey performing yesterday
0.0,1.0,0.0,0.0,What do I do if my classes aren't posted on Canvas?
0.0,1.0,0.0,0.0,is the storm the wall thing still going on
0.0,1.0,0.0,0.0,"

[View Poll](https://www.reddit.com/poll/vspadc)"
0.054,0.846,0.1,0.5994,"I don’t care that cases aren’t terrible in BC right now, they’re okay BECAUSE people have been wearing masks and getting vaccinated. The indoor mandate isn’t over yet, and people on campus are still regularly getting COVID.

I hate studying here because so many people don’t wear masks inside anymore despite the fact that it’s still mandated. It’s always the people who are coughing that aren’t wearing masks too. Do you people *Want* another fully online term again? Cause this is how you get one.

Please, if you care AT ALL about the well being of other people, especially the immunocompromised, just wear a mask if you’re coughing or while indoors at least until the mandate ends."
0.163,0.686,0.151,-0.2939,"

Hi y’all! I’m writing an article about the AMS Block Party. Apparently performers had to stop their sets to control all the crowd pushing and shoving, and at one point a whole section fell over. With the lack of cleanup and trash left over I think it’s important to write a piece about what went wrong with the Block Party. I was wondering if anyone who attended the party could give me some first-hand takes on it? Please shoot me a PM, I would really appreciate it!"
0.4,0.6,0.0,-0.4588,Stop complaining about UBC keeping the mask mandate
0.0,1.0,0.0,0.0,I am ubc student
0.0,1.0,0.0,0.0,"It takes so long to get educated here. 

Also why do we need a degree for so many jobs anyways?  What do employers think happens here?"
0.027,0.932,0.04,0.1179,"I have noticed people cheat so much in CPSC courses. People share codes for CPSC 213, 310, 313, 317, 416, etc with each other. For instance, I took CPSC 313 last term and you took CPSC 310 in the previous term, we can share/exchange project or assignment codes with each other. CPSC 320 has two take-home tests worth 20% of the grade. You need 50% of the weighted average of two take-home tests (20%), midterm (15%), and final (30%) to pass the course. I know people who sat together as a group and did take-home tests. 

Why doesn't anyone report it? Why isn't the CS department paying attention to it?"
0.0,0.82,0.18,0.296,Are there any poker groups i can join near or on campus?
0.0,1.0,0.0,0.0,"Meet Eshana Bhangu, AMS President"
0.0,1.0,0.0,0.0,Places the buy cigs on campus
0.481,0.519,0.0,-0.5719,CPSC 121 Midterm Grading Insanity
0.0,0.244,0.756,0.4767,Dark Humour
0.0,0.934,0.066,0.5588,I’m looking for vegan food options in UBC but there doesn’t seem to be many options. Am I the only vegan person here? What do other people here do to eat vegan meals when they don’t feel like cooking/ don’t have time? I can’t afford to get delivery vegan meals from out of UBC.
0.0,0.723,0.277,0.9753,"Hi everyone,

I am trying to connect my Alexa Echo Dot Gen 3 and Evolux bulb to the UBC wifi. I need my MAC address or device ID to register it at UBC but I couldn't seem to find it. Anyone has the experience of registering them mind to help me out?

If you don't know how to help but still feel like helping, an upvote would be nice :)

Thank you in advance."
0.0,0.674,0.326,0.4404,Thanks for coming to my ted talk.
0.0,1.0,0.0,0.0,Does anybody know the procedure for joining clubs at UBC?
