0.0,0.0,0.0,0.0,
0.064,0.868,0.069,0.5271,"Does anybody else find the grading for the first midterm absolutely ridiculous (specifically Question 4a,4b,4c)?

The questions are phrased so generically like ""Give the result and clearly show each step,"" and ""Explain why....,"" but then the answer key has some specific exact requirements that are necessary in order to achieve full marks. **For anyone who hasn't taken the course, I can see how this may seem reasonable, but I assure you it is not.** At one point (Q4a), you lose 0.5 marks for not converting your final binary answer into decimal form (even though the question only asks for the binary answer). How is this reasonable? The ""Show the answer is correct, by converting it back to decimal"" requirement in question 4a seems like the biggest indicator of this teaching team's inept expectations- you want me to read your mind? For real? Whenever a student highlights this on Piazza, we receive the same uncaring reply ""From the post: ""We will not answer any questions regarding the exam until the regrade request period is over."" Why not? If you have such expectations from students, why can't the teaching team explain their reasoning? This isn't coming from some disgruntled student who failed, this is from someone who took the midterm seriously just to have gotten screwed over by the teaching team's ridiculousness.

4b is a simple ""explain why"" question, I felt like I blew it out of the water with a simple answer highlighting that the given arithmetic operation was outside the bounds of a positive signed binary representation, yet the rubric suggests explaining how 2's complement works which is literally the most basic concept we learned, it's like asking a grade 8 student to explain how to represent a base 10 number.... The question generically asked us to explain why, it didn't ask us to divulge into overflow or any of the above. If you wanted us to go over that, then include in the frickin question ""Is there overflow/underflow/no error?"" How can you include something in the rubric after asking students to just ""explain why?"" Even though we have full understanding of the material, we can't guess the exact answer you are looking for, **especially when it's framed in a qualitative format**. In response to complaints on Piazza, the professor responded with ""The question already said that it is not possible to represent 32+32, so saying this is larger than 63 is not enough."" But that's the exact reason... we weren't asked to dive deeper into ""why that's the highest number,"" we were only asked to ""explain why"" 32+32 is not possible. If you wanted a more specific answer, then you should have included ""If it's outside of the scope, why?""

Now I can understand the deductions if we were given grade weightings per question, but this 3 part question was just assigned an overall of 18 marks, so there was no way to determine the complexity of each of the individual sub-answers that they desired. 4a and 4b appeared so simple (simply because they WERE easy) but there wasn't any grade weight visibly attached to it (no ""out of x""), so anyone who saw this would probably feel like it was a short answer and provide the basic solution- not explain how 2's complement works! They should have asked us if they wanted it. I finished 4a and 4b in 5 minutes flat, they were probably the easier questions on the exam for me and my fellow classmates, yet I ended up with 4/9 total. My answers were all correct.... and I got 4/9. Do you know how much that hurts after spending hours studying? I cannot express my anger enough. In anticipation, I know I'll get a response like ""effort doesn't equal results"" but I got the answer right, I just didn't ""describe"" exactly what they wanted. And no, these weren't fundamental things that I should have known to include- they were trivial and unnecessary additions. It's almost as if they completed creating the exam and decided it wasn't hard enough, so they just started throwing in grading requirements that were completely unwarranted.

Question 4C was not explained at all in Geoffrey's section (maybe 5 mins tops, and nowhere near the level of comprehension needed for that exam question), so why were we given this? Yes, it was on a slide, but we never dived into it, am I supposed to learn this on my own?

Idk man, I worked for days studying for this midterm. Tens and tens of hours. Walked out of the midterm feeling like I got 100. After receiving my midterm, and ignoring these arbitrary qualitative ""incorrect answers,"" I should have received a 95- but with all of these stupid unclear grading components, I ended up just breaking 82 (I can't even imagine how students who performed worse must be feeling). This is ridiculous. **They aren't even testing our knowledge at this point. They're testing how closely we can predict what they exactly want as a qualitative answer.** Some of you may argue that this is the nature of a midterm but I disagree, we shouldn't have to guess what exact qualitative response you are looking for, especially if our answer is correct and there are no grade weighting attached to each question. **This entire grading process is a slap in the face to any student that spent time studying for this midterm and actually got the questions correct** (especially question 4a,4b, and 4c)**.**

And what's with this whole ""frivolous"" regrade request thing? Be my guest to make further deductions if you find **other** **mistakes** that weren't accounted for the first time around, but to say any regrade that is frivolous will receive deductions.... ain't that your job?"
0.074,0.782,0.144,0.9981,"Throughout my time at UBC I could never fully wrap my head around why people were so ok with the cycle of apathy in the student union. That cycle went a little something like this. 

Students don’t care about their university, so the new students see that and figure they shouldn’t care either. Then because no one cares enough to vote or sign a petition, or run for office, the student body has no actual sway with the administration who can ignore all their demands like increasing housing, getting rid of mandatory averages etc. 

Let me tell you, that approach to life is a quick ticket to feeling like fucking garbage until you die. Taking the low road or the easy way every time you see someone else do it, that will never get any of you closer to where you want to be in life. You should be using everything you don’t like to inspire you. Trust me, I know as well as any of you it’s easier said than done but by the time you’re done at UBC I guarantee you will be happier if you at least attempted to buck the trend. If you want change, and I know it’s cliche, BE THAT CHANGE. Break the cycle. Vote, say hi to a stranger, put gourds on Santa Ono’s lawn until he lowers the cost of something, try doing literally ANYTHING else instead of doing nothing. You realize that your school experience is up to you right? You realize that other schools have actually legitimately gotten what they demanded because the students actually bothered to give a fuck and protested, signed petitions, had sit ins, let alone took 5 minutes to VOTE? 

So here, let’s take the average student sentiment at UBC and then we’ll talk about the variables that are out of your control, then the ones that are in your control. Odds are you’re a depressed UBC student who feels UBC is so cold and lonely, it’s impossible to make friends and no one ever parties and has fun. School is so hard and the administration doesn’t care about it’s students at all and the AMS has no power to do anything.

First, the variables you can’t control - I’ll be the first to admit that UBC is at a disadvantage for student life because of how many students commute. For all the faults in the general attitude/behavior of students, that one is nearly unsolvable in Vancouver (unless you people actually pressure the university to create more housing, but that seems unlikely considering most of you think not voting makes you cool). I get that that’s part of the cycle, if you don’t live on campus, life is harder (in my experience it’s just shittier off campus/at home, I know it’s harsh but I mean it to be validating). Because life is harder you have less energy for school and you become more detached. UBC is also expensive and a lot of you struggle with time and money whether you live on campus or not. I can’t help you there either, student life is tough for a lot of you, it was tough for me too, especially when I lived at home before moving on campus.

Now let’s talk about the stuff you can control. Let’s be real, how many of you have ever even actually tried to find a solution to the vibe you don’t like at campus? Sure you showed up to clubs day, talked to a  few people, put your name down, and then promptly never attended a single meeting or event. How many of you have ever legitimately even tried to say hi to someone in class more than once? Most of you have never voted, never tried to talk to an elected AMS official about your concerns, never showed up to an AMS meeting or started a petition. 


This is the real important one. 
How many of you have ever even walked on this campus and attempted to be the type of person you wish this campus was filled with?


I don’t need to hear your answer, I already know it. I spent the better part of a decade at this university and I could count the number of times I got that effort from anyone. And you know what? I honestly don’t think I ever forgot anyone who tried to be the type of person we all wanted this campus to be full of. I remember Aaron who sat next to me when I was eating alone at a table and said “I noticed you were eating alone and just wanted to see if you wanted to eat together”. I remember someone who will rename nameless, who taught me how to boulder buildings, have some beers and then come down through the fire escapes. The people I sat next to in class who I still talk to today. I never even forgot the joke AMS candidates who tried to have a little bit of fun and entertain us. And ya you know what, I didn’t have success with every person I talked to, and vice versa as well. But those experiences cost me nothing, even whatever embarrassment I felt in the moment is gone, all I remember is being glad I tried. I’ll admit, I was less successful in all of this than I would have liked, but I was also infinitely more successful than I would have been if I never tried and I was a hell of a lot more successful than everyone I saw who always complained and did nothing. Ultimately it was a good student organization that helped me bust out of the slump that I was in (that many of you are currently in) and made me my best memories and friendships, trust me there's something out there like that for you too, but you have to actually try.

I know this might sound preachy so trust me, I wasn’t like Van Wilder other than how many years it took me to graduate, there were a lot of people who did a lot more than me in their time at this University and I still look up to those people today. But all it takes is a little bit of effort, just a few of you coming away from this saying “I will say hi to someone sitting alone next week”, “I will actually stay on campus an extra 2 hours to go to a club meeting” “I will vote and sign a petition against an academic policy I don’t like” and it really does make a difference. Not all of you will have it in you to try being engaged or outgoing at first, I get it, but if you’re on the cusp of making that effort just give it a shot and you could inspire the people who were just a little less ready than you. Throw a field party and invite random people, show up with floaties and swim in the fountain, try to get people to join the stupid ideas you want to do, it’s all just practice and the more you do it the better you get at it.

Oh and also? Vote, it’s so fucking easy."
0.479,0.521,0.0,-0.4137,Rant about Online Transition??
0.0,1.0,0.0,0.0,Is it possible to become an undergrad TA in a PSYC class?
0.0,1.0,0.0,0.0,Ubc vlog
0.0,0.909,0.091,0.3182,Do you think it is fair that UBC-O grads receive the same designation and degrees as UBC-Van even though the admission standards are different?
0.0,0.729,0.271,0.3818,How are you guys profiting in this market?
0.0,1.0,0.0,0.0,Dealing with parents who visit uninvited for so long?
0.0,0.622,0.378,0.7067,I’m so happy about going back in person!!! UWU
0.0,0.974,0.026,0.2732,"\-Seen and mentioned by a friend but TA because they're on this sub-

The frats have been holding regular events with upwards of 150 people at once. Goes without saying that there isn't a single mask insight and many MANY of them have had covid recently Tonight theres an event too, saw it on snapchat and saw people walking into the fraternity village on my way home

UBC should get rid of greeklife once and for all what more proof do they need"
0.0,0.914,0.086,0.5514,"Just wondering how many profs had people introduce themselves and expected preferred pronouns.

If the prof asked for them in intros, what did they do if someone didn't offer their pronouns?

Do you care one way or the other?"
0.0,0.869,0.131,0.7217,"I am flying back to Toronto tomorrow early morning and I don't know how to get there or on a plane lol. Once I get to the airport (via Skytrain), what do I do? Also how do I get there (are busses / skytrain running very early)? Ty all"
0.065,0.833,0.102,0.9013,"Group 1: Hippies

\- they thrift everything, look homeless, wear hiking boots. They don't smell bad because they're not actually homeless, they just look the part. Are they nice? I don't know, I don't talk to them. Do they look like a flock of pigeons when together? Sorta, I guess you could say they are the pigeons of campus?

Group 2: The finance bro

\- The kid you see wearing a polo shirt tucked into his lululemon sweatpants and nike runners. No need for a polo though, with the modern finance bro, a backwards hat paired with a flannel does suffice. While the stereotype is quite played out, yes he is playing clash of clans and invests in GME. Someone please comment with some new content for this one... I am running out of ideas.

Group 3: Skaters

\- These guys are supposed to be pushing the envelope in fashion, but they all look the same. These guys can be spotted sporting an outfit straight out of world war 2, with baggie pants and all, or roaming in a squad with their farmer. trousers, beanies, and whatever button up they found at salvation army. 

Group 4: Standard Vancouver Man

\- I swear I see these dudes everywhere... maybe I even am one! Generic jogger pants (zanerobes if they were born after 2000), plaint-shirt paired with a black half-bomber kind of thing, where its a bomber style but not puffy. You CANNOT forget the vans

Group 5: Standard Vancouver Woman

\- This is by far the most overplayed stereotype so I will keep it short. Uggs/Nike Blazers if they think they are edgy, lululemon tights, superpuff, aritizia this aritizia that. 

&#x200B;

Last notes:

\- Yes I know I am missing groups. Depending on how much love this gets... there will be a part 2 (fraternity/sorority people, I am watching you)

\- No hate to any of these groups, there are all things I love about your style (yes, even the hippies). Too bad I spend my time judging everyone else's style and not my own."
0.0,0.753,0.247,0.3182,Least he can do is a meet and greet 🥹
0.0,0.684,0.316,0.8074,Is there a way I can get some money from UBC 😅. This would help me boost my grades and perform better overall
0.0,1.0,0.0,0.0,Apparently an undergrad degree takes three years in Britain. Why can’t we do that?
0.0,1.0,0.0,0.0,Saving money?
0.021,0.832,0.148,0.8121,"I would feel self-conscious if I see a prof I know see me drinking and being loud on campus. Somestudents drink outside in public where it isn't technically legal. Would it impact my chances of a good reference letter from them or chances of grad program if they are a potential supervisor?

Would they still see me as a good character or would that image be tainted?"
0.085,0.829,0.087,0.4263,"* Inflation in Canada has been 6-10% monthly this year.
* UBC's budget and numbers are publicly accessible online. UBC is actually running a slight deficit; there is no ""extra money"" that UBC has wiggle room with. In the 2022-2023 projection, UBC reported revenues of 2.538 billion and expenditures of 2.545 billion.
* UBC's operating expenditures will naturally go up with inflation. If UBC does not raise tuition, it will not have enough money to keep maintaining these services.
* A yearly increase of 2% in tuition is effectively a decrease in terms of real money values as it does not keep up with inflation.
* According to [UBC's own budget](https://finance.ubc.ca/sites/finserv.ubc.ca/files/budgeting-reports/2022_23_UBCBudgetReport.pdf), a full third of its expenses are covered by provincial funding. Another third is covered by tuition. Domestic tuition is heavily subsidized by the provincial government. It only makes sense for international students to not benefit from a Canadian governmental subsidy that Canadian citizens pay taxes for.
* The AMS's justification is struggling students and food insecurities. Those points are real. But the solution is for UBC to increase funding on programs that target these low income students (i.e food aid, bursaries). UBC needs to raise tuition to have enough money in its budget to increase funding for these programs while maintaining current services.
* The vast majority of UBC's expenses (2/3) are salaries for staff. These staff also need cost-of-living raises to keep up with inflation. Where will the money to help these staff beat inflation and support their families come from if UBC does not increase tuition?
* University staff are not overpaid. The majority of professors and academic staff could make more money in private industry. These are highly educated people with doctorates and likely years of experience. Their salary data is also publicly available online.

In the end, UBC needs to balance its budget to continue to provide services. We cannot demand both an increase in services while at the same time a reduction in the university's revenue. Students are having a bad time this year. These are poor economic conditions. Everyone is having a bad time. Most people don't want to pay more money. But considering the big picture, it is evident that UBC needs to increase revenue to keep in line with inflation.

The demands of students should not be a halt to increase in tuition. It should be more heavily focused on implementing programs that subsidize students that are struggling. Bursaries, low-cost food initiatives, are good examples. As a student who is not immediately experiencing these issues, I would be willing to pay a bit more in tuition if it meant that UBC could put more towards these programs.

&#x200B;

Throwaway because I don't want to be doxxed / harassed / stalked."
0.035,0.965,0.0,-0.3345,"I really dont feel good so i'm going to test with rapid kit test soon but what happens to my exams if I test positive..?

I cannot write it during summer final exam weeks because I am going back to my home country for the entire summer break. 

Will profs let you write the exam on 29th or 30th of april? since it would take about a week for you to recover?"
0.231,0.769,0.0,-0.2732,There has to be a few. Drop the @s
0.0,0.936,0.064,0.5911,"Anyone has any idea? The grocery at ubc nest is quite expensive. Save on food at the wesbrook village is also quite expensive. The only cheap place I know is the Walmart and Superstore which are located about 50 minutes away from campus. They are just quite far from campus. 

So close to campus, and cheap groceries. Anyone?"
0.093,0.907,0.0,-0.3094,Do you guys think classes will resume on the 24th or UBC is going to postpone a few more weeks? Any thoughts or info?
0.0,1.0,0.0,0.0,In person classes
0.132,0.822,0.046,-0.5423,"Given the current situations (weather & omicron) you'd think ubc would extend winter break. I know it's online but still, I don't wanna go back to class again :("
0.0,1.0,0.0,0.0,Dropping In
0.429,0.571,0.0,-0.128,Postponing in-person classes?
0.404,0.596,0.0,-0.7274,I hate how University is not a safe place to voice your opinions.
0.0,1.0,0.0,0.0,"hey first years,"
0.08,0.92,0.0,-0.1027,Or idk maybe you grunt and pound your coffee cup on the table after every sip too
0.0,1.0,0.0,0.0,Even an A- is fine... my highest score is a B+ and I'm very agsjsjsmdjf about it
0.114,0.771,0.115,0.0258,"I can’t take it anymore. Too many people, too many faces, I can’t focus and feel like I’m dying. Plus I have the constant fear that I’m going to contract the deadliest disease of the millennia so far.

I feel like there is no hope in sight. Walking down main mall freaks me out since I don’t know where to look. I end up looking at my shoes and bumping into people. And I know they all hate me. I wish we could go back to online."
0.1,0.9,0.0,-0.25,Will more places open up over the winter break to eat or am I stuck with burgers/chicken nuggets till Jan?
0.172,0.769,0.06,-0.89,"Especially the newer ones that are glassy, blocky and sheen, they kind of have this post-modern vibe that is devoid of any humanity. I realize that’s kind of the point behind it- to distance ourselves from the ignorant, oppressive past of established culture, but as these buildings are getting bigger and more imposing, (like the nest), the more I feel like I’m being attacked by a world I don’t wanna be in. 

The insides are utilitarian, clean and organized, which I don’t have a problem with. It’s the increasingly imposing futurism of the post-modern externals which depress me and fill me with angst.

*Edit: sorry for the ADHD title"
0.0,0.963,0.037,0.0387,I want to buy a new phone but I don't know how that works here. My service provider is Fido. Are there any shops I should go to or any website I should buy a phone from?
0.0,1.0,0.0,0.0,furry at ubc?
0.0,1.0,0.0,0.0,"if your classes are once or twice a week, imagine if you complete the first classes for a few weeks from 9am to 5pm first (with lunch break) , followed by the next, and so on?"
0.0,0.794,0.206,0.431,UBC dont give a fuck about international students other than for their money
0.169,0.738,0.093,-0.5574,"Hey wazzup y’all shawties. My rizz is negative, my crush got a restraining order on me, my friends want to force me into rehab and therapy. i’m high on delusion-al and am insane. comment if any y’all gay hotties wanna talk."
0.124,0.762,0.114,-0.1801,"I'm a little disappointed that UBC is keeping the mask mandate on, even though the government announced it was safe not to wear one. 

The whole world has decided to move on from this tragic ordeal. Why is UBC sticking to it?

Shouldn't it be up to the individual student to protect, or not protect themselves??

Please keep the comments civil."
0.0,1.0,0.0,0.0,Getting a rapid test
0.0,1.0,0.0,0.0,it’s already snowing. it’s 5am
0.0,1.0,0.0,0.0,When can I get my booster dose vaccination?
0.0,0.762,0.238,0.3612,anyone else feel like piazza is so poorly designed?
0.0,1.0,0.0,0.0,To anyone who had a breakfast sandwich in feast this morning
0.0,1.0,0.0,0.0,Rate my prof
0.127,0.661,0.212,0.9497,"It was fun, the music was good and familiar so you could dance along and for the most part, the people in the crowd were super nice and the food/drinks didn't take too long to get served and there was a pretty good selection. The only problem was it was super crowded but I'd say nearly every party is like that when your closer to the stage/dj. Granted, there were some assholes trying to fight everyone but I can't say the people on this sub spreading negativity are very different. I don't understand how a party that lasted literally 6 hours has genuinely affected your life to the extent that you have to seek legal action and cry like a baby about it. I guarantee you that 80% of the people there had multiple assignments due but opportunities like this are only gonna happen for these 4 years of your life, when you're working your ass off you can forget about going to parties, and its not gonna be nearly as fun because everyone becomes hardasses once they hit the 25 mark, so why not let people just enjoy it while they can?  One night isn't going to lead you to failing all your courses."
0.37,0.63,0.0,-0.4466,MARINE DRIVE BUILDING 6: GROCERIES MISSING
0.0,0.833,0.167,0.4215,"Seems like most people’s opinions are divided on Mercante. So, what is your number one place to get food on campus?"
0.123,0.877,0.0,-0.3009,I am thinking about not attending my exam today if there is snow because I don't want to be stuck in traffic for more than 12 hours.
0.0,1.0,0.0,0.0,What is your Myers-Briggs personality type?
0.0,1.0,0.0,0.0,Where to buy cigarettes on campus?
0.325,0.675,0.0,-0.594,"[https://vancouversun.com/news/local-news/covid-19-new-omicron-sub-variant-ba-2-arrives-in-b-c?utm\_medium=Social&utm\_source=Facebook&fbclid=IwAR1nXnjyY94N6vxBayMElJNwE5mbzN4uOAgqF\_RHR65kXxmueqoNTTY5Xcg#Echobox=1643165840](https://vancouversun.com/news/local-news/covid-19-new-omicron-sub-variant-ba-2-arrives-in-b-c?utm_medium=Social&utm_source=Facebook&fbclid=IwAR1nXnjyY94N6vxBayMElJNwE5mbzN4uOAgqF_RHR65kXxmueqoNTTY5Xcg#Echobox=1643165840)

&#x200B;

Is this real? or just scaring us?"
0.0,0.602,0.398,0.5106,ive been hearing cheering since 2pm
