0.0,0.0,0.0,0.0,
0.0,1.0,0.0,0.0,How are we just going back to in-person if students in greeklife are holding superspreader events?
1.0,0.0,0.0,-0.4588,Outrageous
0.0,1.0,0.0,0.0,AC in the gyms esp Birdcoop
0.0,1.0,0.0,0.0,My prof just decided to not mark my assignment from a couple months ago and gave me a 0
0.0,0.75,0.25,0.25,Any chance online course will get extended?
0.237,0.763,0.0,-0.4215,Dealing with discomfort of prof not wearing a mask in class
0.0,1.0,0.0,0.0,"Discuss for participation grade

Edit: bruh, some of you are not getting the participation grade, go touch grass "
0.0,1.0,0.0,0.0,Anyone shorting the s&p 500? The big short!
0.194,0.653,0.153,-0.0156,Long story short my phone had to be hard reset but I’d really appreciate any clips that ppl have :(
0.0,1.0,0.0,0.0,Advice for UBC Socialist Group
0.095,0.872,0.033,-0.5267,Just landed a few days ago and tested postive on arrival by mandatory PCR testing (had tested negative before taking the plane). I'm wondering if there's anyway to get access to rapid testing as my symptoms dissapear?
0.0,1.0,0.0,0.0,So is the power
0.0,1.0,0.0,0.0,Anyone think of a different Hub?
0.0,1.0,0.0,0.0,POLI 260 - Any leftists wanna attend and/or study together?
0.0,1.0,0.0,0.0,"A story about Eshana Bhangu, AMS President, published in *A Campus Resident.*

[https://charlesmenzies.substack.com/p/meet-eshana-bhangu?r=1juh2p&s=w&utm\_campaign=post&utm\_medium=web](https://charlesmenzies.substack.com/p/meet-eshana-bhangu?r=1juh2p&s=w&utm_campaign=post&utm_medium=web)"
0.574,0.426,0.0,-0.4019,UBC Discord grinding
0.0,0.556,0.444,0.4939,Deans honours list in Sauder
0.231,0.769,0.0,-0.34,Letter: We are making a mistake by closing school again
0.339,0.661,0.0,-0.4724,Stop emailing me to do your surveys!!!
0.0,1.0,0.0,0.0,in need of hdmi monitor
0.0,1.0,0.0,0.0,"My prof said classes will be online, thoughts?"
0.204,0.796,0.0,-0.6249,tonight has solidified the fact that these have been the worst 4 years of my life at UBC
0.0,0.789,0.211,0.4939,What the Food in someone's hand on college campus says about them. (Satire)
0.074,0.77,0.157,0.9836,"Hi all,

I am a part of this smaller class where the prof chooses to not wear a mask while lecturing. I understand that UBC policy doesn't forbade this but I feel really uncomfortable given that he is the one speaking most of the time, the class is quite small. I feel it would be best for him to wear a mask to keep everyone else safe.

I also find it a bit hypocritical that we are supposed to wear masks (which students gladly do for the most part) but the prof doesn't.I personally don't feel quite safe and it is giving me a bit of anxiety. I understand that I could choose to sit at a distance and that will help reduce the risk a bit but I also want to engage in the class so I find sitting at the end not that ideal.

I don't think emailing the prof would help because he might just state UBC policy and continue to do what he is doing. I am also afraid that he would label me ""scared"" of the virus when in reality I am just trying to advocate for a safe learning environment which I have the right to do. Everyone has a different risk tolerance and my preference is to protect myself and those around me by masking up with a high quality N95 mask all of the time. I also prefer that others at least mask up when we are in the same room and that extend to the prof too. 

I would probably feel better if it was a large lecture and I could sit at a large distance away from him. Overall, I still feel it is impacting my learning experience due to my discomfort. 

TIA for the advice in advance! I am not sure what to do or if I should bring it up with the prof."
0.545,0.455,0.0,-0.34,another cpsc rant
0.049,0.913,0.038,-0.6807,"For the record, if you are trans,  and you want to use the bathroom with the gender you identify with, go ahead. More power to you. This really is not about that.

The centre of diversity and inclusion has been spearheading a movement which is seeing the school spending millions of dollars changing over washrooms to be gender neutral.

I don't even get why we are de-gendering bathrooms. Men's bathrooms are functionally different than women's bathrooms. The two genders also use the space outside the actual toilets very differently (socially, etc)

There also the issue that UBC has had multiple incidents of voyeurism in some bathrooms over the last decade.

&#x200B;

I just don't get why this is a pressing issue that the school is spending millions of dollars on. Are we really spending millions of dollars changing bathrooms to appease a very small population? There are students literally living out of cars and using food banks, but this is where we are spending millions of dollars? 

&#x200B;

I would also like to point out the disabled washroom is gender neutral and offers privacy. So it's not even like there weren't already spaces that existed for that specific population. 

&#x200B;

Coming from a ""vulnerable community"" and REALLY struggling financially it gets so tiring seeing issues that impact less than 1% of the student body get millions of dollars of funding while we literally starve."
0.423,0.577,0.0,-0.5267,How do I heal from serious goose attack wounds?
0.0,1.0,0.0,0.0,Roommate says they have covid 19...
0.0,1.0,0.0,0.0,I just took someone’s food from ponderosa commons cedar house commonsblock and man was it tasty
0.093,0.802,0.105,0.0772,"Who reads a book like that?

Makes it impossible to study since I have no idea what part of the textbook we’re on."
0.164,0.735,0.101,-0.9934,"I'm tired of all of these promotions for work from home jobs! I know that some of them can make legit money but way too many of them aren't straightforward or can't cut to the chase because they haven't even tried the application process for these jobs themselves it's so stupid.  They're actually even less lucrative than a lot of in-person jobs, even minimum wage jobs. Yes, I've heard so many times that if it's too good to be true, then it's probably a scam, but now these videos are getting more and more deceptive by leaving out significant details about how difficult it is to actually make money online.

&#x200B;

[STOP WITH THESE B.S. Videos if you haven't tried the applications yourself!](https://preview.redd.it/zhnxcmb0mb191.png?width=737&format=png&auto=webp&s=8841e4346e854ef789d27ac628361aec79e95d9b)

First, the application process for these jobs are way harder than most jobs that require in-person work. Recently, I've been trying these transcription job websites and they make it seem like anyone can do the job if they have fast typing skills and can speak English proficiently. 

&#x200B;

Second, these work from home jobs videos are WAYYY TOO EXAGGERATED! STOP CLAIMING THAT YOU CAN MAKE $800 doing easy work nobody is buying that B.S. I'm tired of seeing that in my Youtube feed it's so annoying. Anyone that makes these videos is so dishonest and isn't doing anyone any favours and lying to not only their audience but to themselves! If you didn't actually go through the application process for this website, then don't ADVERTISE IT!

Third, a lot of these work from home jobs WAYYYY less rewarding. There was this random youtube video where this woman explains how to randomly making money by doing simple tasks like listening to music or reading, when in reality, a lot of these jobs actually require way more expertise and knowledge such as being an experienced voice actor or high-profile music curator. Like why the hell would you waste so much time uploading 200 music playlists to not even make a dollar like HELL NO!

I could have gotten a job at a company that one of my family members used to work for if my brother didn't selfishly disrespect the manager so much, so now our last name has a terrible reputation there.

I wouldn't have even turned to these jobs were it not for the fact that I haven't received relevant information from the positions that I applied for other than ""Thanks for applying"" like oml I need a job. I wouldn't feel this impatient for getting a job were it not for my family asking everyday if anyone has come back to me about a job application or an internship. Like stop, I'm already applying relentless and reviewing resume and cover letter tips and tricks 24/7.

I'd rather work on developing my hard skills or preparing for my second-year courses or writing then wasting them with this job search! I want to do something more valuable with my time then these stupid, unreliable applications for work from home jobs! Seriously so falsely advertised! I already knew they were suspicious but they're so much worse than I thought.

Sorry for the rant but I needed to vent somewhere."
0.063,0.837,0.1,0.9611,"Like the title says, its sucks that in university you really can’t share your ideas or opinions if it’s controversial, goes against mainstream, or even against your prof. Isn’t this a place where we are supposed to share and learn from each other given the diverse backgrounds, rather than having ideas shoved down our throats? I’ve had an incident, and it wasn’t the first, where I the professor would just shut down any discussion that is even a little controversial. Idk maybe it’s because they don’t want heated arguments, but how the heck are we to learn and explore ideas if we aren’t even able to talk about them and hear what the other end has to say. I think if someone has a different opinion about something we should be allowed to talk about it and explore why, instead of forcing assimilation and ideological uniformity. What do you think?

Edit

Okay, this blew up.. lol. It’s hilarious how almost everyone assumed the controversial opinion was about race, sex, or gender. But I guess that’s my fault for being too vague. My hot take was that the earth wasn’t over populated, it wasn’t even an opinion tbh, it was just a sincere question and I was curious about the evidence that suggest so.

The reaction to this question was students outright attacking me and the professor shutting the question and conversation down. Another thing was in my GWST course where my prof explicitly stated that we don’t have to agree with the theories we are studying about (which i agree) and that this class was not a place for discussion or expressing ideas that would offend others.

At the end of the day, I’m not an idiot, I’m not going to go sharing my opinion on stuff i have no knowledge about. I also don’t expect anyone to listen to or agree with my opinion. What i did expect though was that there would be a chance to voice opinions and have them challenged, and there would also be a chance for me to learn why my opinion is “wrong” or “controversial” or “offensive.”

Even if someone has an opinion that goes against basic morals or human rights if they don’t voice it then it’s never challenged and the person would not get the chance to be educated by the very people who are supposed to be educating them in that given environment.

+most of the comment section just proves my point"
0.077,0.737,0.186,0.9933,"Unfortunately I'll have to delete this account once the campaign period is over, but for those curious about my political stances, let me clarify:

I believe the residential schools, and the broader policies of the Canadian government were acts of genocide, and that we need to try our best to undo and repair that damage. This also means ensuring that indigenous content gets into curriculums, including content that celebrates indigenous culture and ways of knowing. 

I believe in gay marriage, and publically funded access to gender affirming care, including those under the age of 18 (so long as proper medical processes have been followed).

I believe that we need to work to address any policies which impede the equal opportunity of people of color. 

I believe that UBC needs to do more for students with disabilities, immunocompromised status, or who have family members with those conditions in their care. 

I also believe in the freedom of speech, and that, barring hate speech and calls to violence, the university should be an open forum for discussing all ideas, no matter how difficult. Southern has a huge following, and is local, and needs to be contested, hence why the event was programmed as a debate. The SFE takes care to ensure that all events are free so that students can come and challenge our speakers without financially supporting them. 

Admittedly, my frame of view is limited to my own life experience, and I strongly believe in broadening it through conversations with others, which is why I've met with the SASC, people of color, and asked the Pride Collective to meet before my campaign began. Going forwards I'd like to stay in touch with these groups and continue to discuss the support they need. 

I had a wonderful discussion with students today at the indigenous forum, where they were able to ask me questions about this specific issue. I would welcome more of that feedback and criticism, and genuinely look forward to integrating their ideas into the work I do, and hopefully keeping in touch - whether I'm elected or not. 

- Tate"
0.0,1.0,0.0,0.0,"does anyone have an HDMI monitor I can buy from them, 20-24 inch possibly?"
0.0,1.0,0.0,0.0,Grad Tents at Buchanan
0.313,0.687,0.0,-0.7501,UBC is putting exams on as scheduled despite the still highly dangerous conditions. This is unacceptable.
0.463,0.537,0.0,-0.824,"Letter: No, the weather is not nice. It's a sign of the climate crisis"
0.0,1.0,0.0,0.0,Would you listen to a UBC Student Podcast about BIPOC experiences?
0.0,1.0,0.0,0.0,In the email UBC sent in December they said we would hear more in the first week of the new year but I haven't heard more. Then I read that we would hear more on the first day of school. Does anyone have any idea when UBC will let us know what is happening?
0.11,0.736,0.154,0.4579,Just did my first lab interview in life for a RA position and i felt like i messed up. I always aim for a good grad school although i just start my second year. and right now i feel like i might not reach the goal.. anyone has lab interview experiences or smt similar to share? maybe seniors/upper year lvls or alumni? so sad :(((
0.0,0.821,0.179,0.5859,Hi Quick question would any of you be interested in a BIPOC podcast about being a student at UBC and BIPOC experiences in Canada as well?
0.0,1.0,0.0,0.0,We should start a petition on change.org concerning this snowfall and exams.
0.0,1.0,0.0,0.0,"

[View Poll](https://www.reddit.com/poll/xn59si)"
0.0,1.0,0.0,0.0,does ubc have a hookup page? i have heard there is one
0.065,0.9,0.035,-0.1406,"Seriously,

IT support has said it's a privacy issue but it's weird to send emails to professors or professionals outside UBC with emails from: ""CWL@student.ubc.ca"" and not ""John Smith""

If TAs can have their full name on emails then it obviously isn't too much of a privacy issue.

What are your thoughts?"
0.0,0.633,0.367,0.4404,When will UBC mandate better masks?
0.109,0.773,0.118,-0.3055,"I really hate the decision to have in person classes. No matter what there will be people who put others in danger. Especially in an environment like university where the institution likes to pretend what people do while being enrolled is not their problem, people are emboldened to not care about others for the sake of their ""university experience"".

It's lit. Let me stay at home so I can sleep in and not be scared that the guy sitting behind me in lecture attended the party friday night.

&#x200B;

edit:

Allow me to clarify here, I'm not worried about catching covid that much, I'm healthy. The problem is that constantly opening and closing school when covid isn't completely gone is ableist and best and negative eugenics at worst. I have the priviledge of being able to take a year off if I really wanted to, but I know that there are people who don't, whether it's due to financial issues or other,  and when these people can't take time off and also are high risk, we are telling them we don't care about their lives. 

UBC earlier put out a statement saying that the risk of spread in education settings is low. This may be true, but does it matter when we are crammed in lecture halls next to those who show up to school the next day after attending a party with confirmed covid cases? I would think not. 

Solution? UBC needs to commit to something. Commit to online until covid is actually controlled, commit to harsher penalties for students who are actively putting others at risk, or commit to hybrid classes so that education is accesible to everyone. UBC already took a year off from in person school last year, but jumped the gun on reopening, just like the government and most countries in the world. If this keeps up, it's going to be a permanent cycle. 

UBC is one of the leading universities in the world in diversity, yet these actions show how little they care about inclusion. "
0.031,0.839,0.13,0.8141,"got an offer rn at around 3:50 am?? $6000 so i think they’re going lowest to highest if any of yall are waiting (i saw a person who got it friday ish $5000) 

the scholarship description says it would be $2500-$5000 anyone know why it says on ssc they’re giving up to $10,000 each? i was so surprised to see over 5k lol. is it because not a lot of people applied so they increased amounts per person or something?"
0.142,0.751,0.107,-0.6124,"I follow this sub to see engaging, positive, interesting, etc,  content about UBC, not to constantly see people complain about depression or other related issues.

I understand that this is an issue affecting people but these kind of posts are being made multiple times a week. Moreover, I don’t see the value in spreading negativity to other people on this sub; if I wanted to see depressing content, I would be following r/depression and not r/UBC

Thoughts?"
0.0,0.674,0.326,0.4404,Who are some attractive profs at UBC?
0.0,1.0,0.0,0.0,should you go write an exam if you have symptoms?
0.0,1.0,0.0,0.0,Is anyone up for a dance cover at the showcase??
0.119,0.797,0.084,-0.7352,"So I just had my first POLI 260 lecture and, wow... where do I even begin. As a filthy Marxist, I found that physically painful to sit through. There's only so many Cold War-era takes I can handle before my brain goes numb, and this 3 hour class for some reason has no breaks! 

I can already tell that, going forward, this class taught by the US Air Force(!!) employed instructor is gonna be very cool and unbiased. 

If there are any other lefties or, god forbid, Marxists in the class who want to attend lectures and/or study together pls slide in the DMs, I pinky promise I'm not a CIA operative. I'm not sure my ADHD diagnosed ass can power through almost 2 months of this by myself, so let's put the social in socialist and get through this together! :)"
0.0,0.751,0.249,0.9613,"Hi guys, I'm in one of the shared room year-round residences (units that have separate bedrooms but shared kitchens and bathrooms)

One of my roommates says they have covid-19; are there any official rules that prohibit them from using shared parts of the unit like the Kitchen? (technically aren't you supposed to temporarily move somewhere else if you test positive and you're in a shared dorm?)"
0.0,1.0,0.0,0.0,"And if possible, how does one get this position without having to directly apply? Seems impossible considering the process prioritizes grad students."
0.11,0.89,0.0,-0.4767,"Do you still think classes will remain online after January 24th? Cases are getting worse in BC, and literally > 50% of people I know has gotten Covid."
0.069,0.783,0.148,0.9503,"is that when I ask y'all about why you went into CS the answer is always money... like I'm not judging but holy moly is it a boring answer. I've been into this stuff since elementary school and have an entire bulging portfolio of interesting projects. 99% of people in CS just have a single TODO list console app they made in 210. I think in my four years in this program I have met literally 4 people that actually were into comp sci.

Aren't there any more people out there that actually love this shit? I want to see cool projects and discuss how you made stuff.  Please for gods sake if you exist send me a DM.

For those who don't understand this. Imagine you were an English student but nobody wants to talk about literature, cinema, books, poetry, etc. you would be pretty bored would you not?

&#x200B;

Anyways thats my rant, bye.

edit:

a bunch of people have messaged me saying they feel the exact same way! Really glad I made this post because now I've been able to connect to other cs interested peers. "
0.0,1.0,0.0,0.0,Where to watch the 2022 FIFA World Cup on campus
0.0,0.907,0.093,0.6369,"I’m just your average arts student here. Shoutout to all the grads and their families taking pictures right outside of the Buchanan buildings today, as I am probably in all of your pictures now. Love how they had that happening during class time"
0.274,0.472,0.255,-0.0516,Anyone wanna go to block party together?
0.0,1.0,0.0,0.0,Ride
0.044,0.802,0.154,0.6926,"does anyone have the adhd grant? if so, how does it impact your student loans? i’ve heard that it replaces a portion of your loans, however i’m curious as to what this would mean for the submitting of receipts? i use my loan for things like rent, food, etc. so i wouldn’t want this to cause problems"
0.326,0.674,0.0,-0.4404,I'm tired of this(Work from Home B.S.)
0.0,0.675,0.325,0.4374,Please tell me UBC has a Football community!!
0.0,1.0,0.0,0.0,UBC Okanagan grads get the same degree as UBC and it doesn't say Okanagan on their diplomas.
0.0,0.707,0.293,0.4404,Hope you get a firm result on your finals
0.256,0.744,0.0,-0.4767,Name a club with worse main character syndrome than acapella club
0.0,1.0,0.0,0.0,Summer semester is a month & a half??
0.232,0.449,0.318,0.3182,"Given all the negativity on this sub, I would like to say that I actually enjoyed the block party."
0.0,1.0,0.0,0.0,UBC Email?
0.0,0.827,0.173,0.3182,Can university courses not jump back and forth between textbook chapters please?
0.0,0.753,0.247,0.3182,Securing Black Futures Brings High Schoolers to UBC
0.324,0.676,0.0,-0.34,rant about an awfully designed course
0.016,0.862,0.122,0.9349,"i didnt know rental of graduation gowns costs 55 dollars until i was on the gaspard website today, but why do we must wear it? besides feeling ripped off for this overpriced and monopolized rental business, the tradition itself seems pointless to me, its history is rooted in religion and patriarchy, and i cant wrap my head around why we cannot dress however we want for our special day. i am thinking of wearing my own cloths but dont know if they will kick me out of the ceremony for it, sent an email to [ceremonies.graduation@ubc.ca](mailto:ceremonies.graduation@ubc.ca) asking about it. but i want to hear everyone's thought on this, id love to be convinced on why i should conform to this tradition and why it would be unwise of me to attend the ceremony in my own clothing."
0.0,1.0,0.0,0.0,"Out of curiosity, how many doses of the Covid vaccine do you have/plan on getting."
0.136,0.864,0.0,-0.296,Wondering cuz I’m currently outside of Canada and have no clue when to go back
0.306,0.694,0.0,-0.296,Exclusion in the name of inclusion?
0.0,0.488,0.512,0.6369,All the best at U Mich
0.0,0.934,0.066,0.0516,"All exams scheduled for Wed, Dec 21, 2022 on the UBC Point Grey campus will proceed as scheduled."
0.0,1.0,0.0,0.0,Snowing on Campus?
