0.0,0.0,0.0,0.0,
0.125,0.695,0.18,0.9919,"I know this post is just the weekly whine about having no girlfriend or friends but I really need to rant. My romantic life is in shambles (just lost another girl) and what ""friends"" I have don't care about me.

All my life I've been super lonely - I feel like no one really likes me or cares to know about my passions or kindness or even just my personality. I'm about to graduate and I've only ever kissed one girl, that's right, a SINGLE girl.

Now hear me out, you might think that hey at least I kissed one, right? Wrong. It was in first year (4 years and 3 days ago to the date) and some people on my floor invited me out to wreck beach. Well we ended up playing some truth or dare and someone dared my crush to kiss me. A brief look of disgust passed over her face before she laughed and passed the dare onto another girl (she wasn't as pretty), who after a lot of coaxing gave me a small peck on the lips, after which she ran away laughing with my crush. I never felt so humiliated yet so longing for human affection again.

Ever since I've been trying to forget about it and have been actively trying to date and meet girls. Well I made a tinder at the start of last year when things went back to in person and since then I have had maybe 10 or so matches, and most of them unmatched me after I sent the first message. Same luck at bars when I do end up going, women just assume I'm too ugly/short and don't give me the time of day.

I thought my luck changed this night when my ""friends"" and I went to the welcome back BBQ. We pre drank and there was a cute blonde girl and we actually had an intelligent intellectual conversation. At the concert we made eye contact a lot and she even danced with me a bit. So we go to the pit and we do more rounds of drinks and afterwards she asks if we can walk back to my place, note she said TOGETHER. Oh boy I'm about to lose the vcard! No, on the way back my ""friend""/roommate tags along and the entire walk he's flirting with her, I get so angry but I can't say anything. By the end of it we are already back at the dorm and they start making out in the kitchen so I just leave the living room and eventually I hear them banging in the next room. I wanted to cry and scream and I just closed my eyes and walked outside. I've been up all night because I am just so upset at how pathetic I am, I couldn't even get a kiss from her.

I'm seriously going to graduate with nothing to show for it, this is my last year, I was told university was a liberating time to experience and enjoy yourself, I see all these happy people with tons of friends (that actually like them as don't think of them as walking jokes) and tons of girls and in contrast there's me who no one thinks of or is attractive enough to get a girlfriend."
0.0,0.843,0.157,0.0772,I just want to get some work done dammit.
0.0,1.0,0.0,0.0,YESSSS
0.128,0.845,0.027,-0.86,"Today I was having a conversation with a Chemistry teacher (I’m in high school) and we got to the subject of universities. I said I wanted to go to UBC because of how nice it looked and how there was a literal beach on campus. My teacher is a UBC alumni.

My classmate beside me later told me that the beaches at UBC are actually nude beaches… I did not know this. That is VERY embarrassing and i have no idea if any of my other classmates knew that aswell. Did I just accidentally broadcast myself as a weirdo? I may have just lost a reference 😭😭😭"
0.012,0.927,0.06,0.8738,"Imagine you join a swimming class without knowing how to swim, and the first thing that you do is watch professional swimmers and analyze what they are doing wrong. You are taught about the intricacies of how their hands are meant to enter the water for various strokes, and how important flexibility is when doing breastroke kicks. A week into doing this, you then receive an assignment, and it is to get on a boat, go out into the ocean, and rescue a drowning child. Does any of this make sense? Obviously not.

Now imagine you join a second year CPSC course, and the first thing they do is show you how to debug java code, and how to read java code. In fact, this is most of the course until the midterm. Then they tell you that you also need to design your own code, and use techniques and parts of the language they don't, and will not discuss in the course at all, never mind teach you how to use. ""Read the documentation"" they say. Also, you need to make progress every week on the project, and if you don't do this we can kick you out of the course.

I really don't understand how this makes sense. In the first year CPSC course the homework and labs reinforce what we are taught in lecture. We don't just get thrown to the wolves. Is this how the rest of the CPSC course are?"
0.072,0.764,0.163,0.8315,"In my first year of UBC, I visited some friends at SFU, Langara, Kwantlen and thought stuff like, so these are the students with lower grades and couldn't get into UBC. It probably isn't ethical and incorrect (since many of them have higher grades and wanted to save money or liked their program) and then once in a while I bump into a VCC student. Maybe I'm biased because growing up, my parents would say things like ""Don't go to VCC, Langara, or a college. Go to UBC"""
0.0,0.0,1.0,0.4574,help!
0.0,1.0,0.0,0.0,is the mask mandate still in place in IKB?
0.0,1.0,0.0,0.0,"

[View Poll](https://www.reddit.com/poll/xdgh2o)"
0.069,0.753,0.178,0.875,"I'm bad at english like essay type of stuff, so if someone else can write it, ill be happy to sign it. Lets be proactive and do something about it.

&#x200B;

edit: just dm the link and I'll update the posting. Thank you.

edit: In-person and on-campus exams scheduled for 8:30 a.m. and 12 p.m.  Tuesday Dec. 20 on the UBC Point Grey campus have been cancelled due to  weather conditions. The next update on later exams will come at 9 a.m. Dec. 20. So we will see then if we want to create a petition or not. Thank you everyone for the support. "
0.092,0.781,0.128,0.6775,"1. Capitalism has blended into social life excessively, as a result of rent culture. 
I remember my ex girlfriend fucking her landlord at some point. She did it for fun. She was already my ex it wasn’t drama lol. 

2. Blanket of social awkwardness covers the city. 
Ever try making eye contact in Toronto, nobody cares. It’s normal. 

3. LA mentality without the actual accomplishments. 
You go to an la party people are posh and high nosed for good reason, dude has a Grammy, chick is a runway model. 
Upnosed Party in Vancouver is a bunch of parents paid for everything people. 

4. Downtown Vancouver is a mess. It’s like a dying hippy culture of mixed with people who hate hippies. People who hate free love specifically with people who are toxic about free love live in the same spot lmao. 

5. Talking about the weather. This is its own category because it will slowly make you insane. 

6. The normalizing of Transactional relationships through constant “empowering” neoliberal pop psychology idioms: nobody can think for themselves, lots of repetition and agreeableness suffocating authentic sociality ; the number of times I got laid just because I wore a 500 dollar watch made me sick to my stomach about the state of humanity. 

7. Nice but not kind: in the east coast, we will call you all kinda nasty things but help you when you are in need. In the west, people just be like “aww that sucks, see ya!”

8. Last but not least, before Vancouver I believed in protesting Jordan Peterson; after living there, I now believe in Kanye."
0.0,0.878,0.122,0.5362,"I'm proud. The perks of being #1 in your province, eh? Keep it up.

Also, what's up with those occasional kids wearing U of T hoodies at UBC?"
0.0,0.702,0.298,0.6413,To The Very Cute Guy in the Life Building (The Sequel!?!?)
0.292,0.708,0.0,-0.9376,"Hi there, I'm thinking about going to school again, but I'm not sure.

Would I be allowed to just sit in any class to check it out?

Edit: Damn, if you're just going to be a condescending dickhead, no point commenting. "
0.0,1.0,0.0,0.0,Petition to have real names on student emails
0.0,0.855,0.145,0.1779,For those of you casually flexing UBC hoodies in downtown Van
0.107,0.859,0.034,-0.9495,"Hi. Obviously, you can tell from the title that I am an international student at UBC. I understand why we as international students have to pay substantially more (almost 5x more) than Canadian citizens. I know that Canadian citizens have been paying taxes their whole lives, which offset the cheap tuition offered by public schools in Canada. However, I don't understand why this school is the only university I have seen AROUND THE WORLD where there are no set dates for our finals. WHAT THE FUCK. I'm trying to go back home for the winter break to spend the holidays with my family and I'm trying to book flights for my trip back. But the lack of information about our finals schedule has been really fucking with me. I'm already paying a substantial amount for tuition. Now they expect me to pay EVEN MORE for me to go home for not even 2 weeks. JUST FUCKING RELEASE THE FINALS SCHEDULE SO I CAN PLAN HOW LONG I CAN GO HOME FOR. IT IS EXTREMELY EXPENSIVE FOR ME TO DO SO, HENCE WHY I WOULD LIKE TO TRAVEL HOME FOR THE MOST AMOUNT OF TIME POSSIBLE. JUST. FUCKING. RELELASE. THE. FUCKING. SCHEDULE. SO. I. CAN. BOOK. MY. FUCKING. FLIGHTS. Fuck this school. The administration only sees international students as a way to fund extremely ridiculous and expensive projects around campus. fuck ubc. sorry."
0.0,0.913,0.087,0.3182,"Hot Take: It is entirely reasonable and expected for UBC to increase tuition by 2% this year, and the AMS tuition protest's demands are misguided."
0.0,1.0,0.0,0.0,Is a relationship between students from different faculty sustainable?
0.0,1.0,0.0,0.0,TERM 2 SHOULD BE ONLINE
0.282,0.718,0.0,-0.2411,You're not cool for not voting
0.111,0.729,0.16,0.881,"I feel intimidated by Asians places (restaurant, supermarket…). Let me explain. 
I am mixed (white and poc) but not Asian. However, I’m really interested in East and Southeast Asia and love their food but I’m always so intimidated by them ??
I feel judged because I’m not as good as them for simple things like using chopsticks (I’m pretty good tho hehe) and I don’t feel comfortable there since I don’t go often. I’m also always scared to be seen as a Koreaboo or weaboo or whatever. 
Plus, im new here and in my home country, communities are more blended (less communitarianism) and there are way less Asians. 
So when I go to an Asian restaurant or supermarket I don’t feel welcomed and judged when it’s probably not happening at all. 
Are you feeling the same ? I’m usually avoiding the H-Mart area bc of that"
0.2,0.8,0.0,-0.25,How to know if my flight is actually cancelled
0.141,0.706,0.153,0.0516,What do professors think when they see their students drunk and partying on campus?
0.0,1.0,0.0,0.0,how's the queer culture at UBC? and fellow UBC queers wya 🥺
0.244,0.756,0.0,-0.4404,are there any secluded places to get down and dirty 😏
0.0,1.0,0.0,0.0,arts international student scholarship
0.0,1.0,0.0,0.0,Fifa World Cup Showcasing
0.013,0.86,0.128,0.9991,"**\*\*NOTE\*\* I'll be doing an IG live tonight on my main Instagram (@romihajizadeh) to just hang out and answer questions!! I'll do this live probably around 8 pm PST so check it out if you'd like! Polls open at 12:01 am PST Monday 😝 😝 😝**

Hi UBC besties!!

My name is Romina (AKA the girl handing out candy in IKB), I use She/Her pronouns, and I'm super excited to be running for the Senate!! I am a second-year student in the Faculty of Arts hoping to major in International Relations and minor in Middle East Studies. I also lurvvvv Reddit so I'm excited to be posting on here!

This past year I have served as the Chief AMS Representative for the Arts Undergraduate Society (AUS), making me both an Executive at the Constituency level and a Councillor over at the AMS! At the AMS I am also the Chair of the Human Resources Committee, and a Councillor on the Governance and Operations Committees. Finally, I am also on the AUS Governance Committee!! Thus, this past year has really exposed me to various levels of student politics and equipped me with relevant skills such as problem-solving, outreach, and leadership, all of which I believe will help me on the Senate if elected!

Onto my platform -> if elected, I hope to focus on three main areas:

**Compassionate Academic Policies**

As we move out of the pandemic, it is important that we continue to prioritize students' mental and physical wellbeing. In working with staff, faculty, and other students, I aim to streamline the lecture recording process at UBC so that recordings for lecture-based courses can become the norm here, even after the pandemic. Recordings are far more accessible for our immuno-compromised population at UBC, and many students (including myself) have benefited greatly from having recorded lectures to study from for midterms, finals, and large papers.

I have a more personal passion project of also advocating to extend the Cr/D/F period to match similar institutions. Simon Fraser University has their Cr/D/F period up to the drop with a W deadline, which is normally after the first midterm. If our Cr/D/F timeline matched this, I believe this would reduce a lot of stress for students, particularly first and second years who are still exploring everything University has to offer and often change their degree plans during those formative years.

**Senate 2023 Goals on Climate Justice and Reconciliation, and Planning for Senate 2026**

The Senate 2023 document is a list of goals drafted by previous student senators to work towards throughout the triennium. As we reach the end of that three-year period, it is crucial that many of the goals in that document are achieved, particularly the ones related to Climate Justice and Reconciliation (in my opinion)! I've linked the Senate 2023 goals document [here](https://senate.ubc.ca/sites/senate.ubc.ca/files/downloads/20210210%20Senate%20Materials.pdf#page=197) (it begins on page 197) for more context, but I primarily want to focus on implementing topics related to Climate throughout curriculums in all faculties here at UBC, as well as making sure the Indigenous Strategic Plan becomes an integral part of every standing committee at the Senate.

I hope to work with the rest of the Student Senate Caucus on drafting another goals document for the next triennium, after a lengthy outreach campaign where we can talk with staff, faculty, and students from various different backgrounds and perspectives to make sure our advocacy is accurate and effective! This leads me to my next point:

**Engaging the Senate with Students**

It's true that many people do not really know what the Senate does. To be honest, I had to do a LOT of research and am still learning along the way! I think a large reason for this is related to a lack of available information as the Senate does not regularly update minutes on their website (more related to staffing issues) and because the Student Senate Caucus has never really had a solid presence on our campus where people can turn to and ask questions.

When I ran for AMS Representative last year, I had similar goals of making the AMS far more accessible and accountable to students. These goals came to fruition in an interfaculty AMS Townhall event we hosted via Instagram Live, where we asked students to submit questions through a Qualtrics form in advance and got those questions answered by AMS Staff and Execs. This was both an opportunity for students to learn more about what the AMS does and hold their elected student representatives accountable.

I think similar events can be done for the Student Senate Caucus, and if elected, I would like to devote much of my time to planning these interactive events, both to increase awareness of what the Senate does and help our Student Senate Caucus in our advocacy work. Further, I'd love to post regular Senate updates right here on Reddit and other social media platforms monthly, so that students are consistently in the loop of what's going on, can provide feedback to us on our work, and can ask any questions they have in an informal setting!

&#x200B;

[hehe my posterrrrr](https://preview.redd.it/uqp86frqmtl81.jpg?width=2700&format=pjpg&auto=webp&s=c55ebb4fd6f84c48c8a7033b6427adbcd02a3c2f)

&#x200B;

Ask me any questions you have!! If you have a more personal one you can also private message me here or on Instagram (romihajizadeh or voteromi)!

Two more things: I encourage you all to vote this year, even if not for me, because your representation matters AND because the AMS is doing an amazing Elect Change campaign this year, where for every vote cast $2 will be going to supply vaccines around the world (up to $30,000). I'm sure we all understand just how bad vaccine inequity has been throughout the pandemic, so I hope you all vote at least for this wonderful cause!

Further, I hope you all support the referenda this year! The SASC fee increase will allow this amazing service to continue running, which provides SO much support to students every day. The Bike Kitchen also provides amazing resources to our community and I for one cannot imagine our campus without them. The AMS referenda coordinators will be talking more about these throughout the week so I also encourage you to go chat with them if you're curious about the referenda!

Thank you to everyone who made it this far despite all my rambling (OMG THIS IS SUCH A LONG POST LOOOOOL) and have a wonderful rest of your weekend - time to go cram a bunch of assignments LMFAOOOOO"
0.045,0.831,0.124,0.6072,"One of my friends just told me the Summer semester is split into 2 semesters….around 1.5 months for both….is that actually true (if so, do you find it to be a nightmare or is it just fine) or is it misinterpreted?? (I don’t go to UBC fyi)"
0.055,0.776,0.169,0.6115,"I want to be more social and make more friends. I'm thinking taking a shot of bourbon before leaving for class might help. I'm not trying to get drunk, maybe just a very slight buzz and let placebo do the rest."
0.0,1.0,0.0,0.0,"[https://students.ubc.ca/enrolment/exams/exam-clashes-hardships-cancellations](https://students.ubc.ca/enrolment/exams/exam-clashes-hardships-cancellations)

&#x200B;

&#x200B;

https://preview.redd.it/pj9pu9xij67a1.png?width=725&format=png&auto=webp&s=65185bc7ddbd68236fddf65baf5ac29e4ff1597a"
0.212,0.703,0.085,-0.7819,"As more and more gets written about how cloth masks are not that effective, especially against Omicron, when will UBC start mandating better masks? Personally I hate masks, but if we are going to be forced to wear one , they might as well be effective."
0.0,0.762,0.238,0.3612,Who could recommend some dating Apps? Maybe I just try.
0.0,1.0,0.0,0.0,What is your S-tier campus restaurant?
0.167,0.833,0.0,-0.2023,Do the highs of this school year outweigh the lows
0.0,1.0,0.0,0.0,UBC Kink Club?
0.423,0.577,0.0,-0.765,I’m tired of seeing all the depression posts on this sub
0.0,1.0,0.0,0.0,Do you think it is possible for any of your classes to be compressed into only a few weeks?
0.0,1.0,0.0,0.0,Does anyone know the racial demographics of UBC?
0.061,0.804,0.135,0.9982,"  

Hi, this is just a reflection as a final year student at UBC and a possible advice/support for people like me, I would like to mention that I am an International Student and studying Applied Science at UBC.

Expectations of UBC as a first-year student for me:

Friendly city, UBC ranking below 40 in Global Ranking, and is very supportive, UBC is near the beach and has a lot of facilities to support all your sporting and academic needs.

I would like to say that all these expectations will vanish within the first term or the first year this is because UBC attracts average to above-average students in terms of academic success all over the world and the way it academically tests you will make you forget all other expectations you expected from University and will also make you lie in the bed even if you had time to do other extracurricular activities.

Vancouver may be a friendly city but the people in it is hard to be befriended and as a person like me who expect 50% contribution in a relationship it is relatively very hard and there is a heavy chance you will never find a deep connection with anyone even if you stay for 4 years, study group friends will only be friends during study group, class friends will only be friends when you are in class and Vancouver friend will only be a friend until you stay in Vancouver.

UBC does more than other universities to provide mental health support to its students, but I think most students will never tend to utilize it or will be a thought that it does its bare minimum, The way UBC mental health support will work is it will tend to acknowledge your worries but will never get rid of your problems.

At most all times Vancouver weather will be a deciding factor in your decisions, it will crush all your plans you have most of the time subconsciously or consciously, and the f\*\*\*\*\* sun, where is it????? Which you will always be tending to ask yourselves.

UBC like other universities will always tend to get money from you, the tuition fees you expected and will be paying will be vastly different, especially for an international student on a Budget, UBC will penalize you, and all your mistakes will have real-time consequences and it will induce a great amount of stress in you.

The food insecurity you will feel in this University is greater than in the poorest country you will find in the world, your food will get stolen, and you will face many days where you have eaten nothing considering the budget, the food will never taste as good as your home country and be very overpriced.

Never expect professors like Richard Feynman in this University and you will barely find a few or may never find one, they have their own issues and most of them will acknowledge what the students are going through but they are certainly not angles in teaching, From my 3rd year onwards the classes I have attended is less than 5, Most lectures will make students zone out and not really make you learn anything, I personally found 1 hour of lessons learned in lectures can be learned less than 15 mins if you can spend a focused, concentrated session. Libraries are the primary saviors of this university and will make you achieve the expectations from your course. Of course, you will miss a few intricate details from your professors and can damage your marks by about 5-10% which I think is worth it.

If you would like to think if this is all worth it for the value of the degree and the name of UBC in it, I can prove it wrong too, most of the lessons you learned from the university won’t necessarily give you the skills as the same person that have been practicing the work you admire for this 4 years, the theory you learned from the University can be answered by a couple of A.I’s in the upcoming years and I will give max 10 years before the whole education system will collapse if it doesn’t change its ways. This degree won’t necessarily fetch you more money than the people who have spent working these 4 years. I would like to think of the degree as more of a setback than a push in the world for which you already have lost thousands of dollars.

Now comes the good part, Do you guys really think that I could have achieved this type of reflection if not for UBC, The degree will provide fundamentals for you that you need to sharpen in order to achieve some type of use, UBC will make you realize the true you for which most people won’t understand till 35-40 years of their age, It will make you realize that everyone is facing some type of hardships in their life and the hardships a person can withstand depends on the number of heartaches they already had, it will make you realize never hurt a person because of the hardships you are facing, it will make you realize the things you are grateful for.

I would like to finish off with that even though UBC is not Harvard or Stanford, the amount of stress it itself supplies and the amount of stress because of its nature, location, etc… it unintentionally supplies will make you realize surviving UBC is survival of the fittest and from my approximation, you are already in top 1 % of the world even if you would have survived one term of UBC.

I would like to acknowledge that my reflection will bring a lot of controversies and lots of impulsive decisions could be made. I recommend that you give yourself some time to think about your decisions and whatever decisions you will make should be the best decisions of your life. This reflection is for people who are personally like me, and I agree that everyone is different.


Edited:

I would like to mention that everyone has faced different situations in this University, I don't want to spoil anyone's fun, but I wanted to share this as a warning to at least one human that's facing a similar situation as me, I'm not being pessimistic I just want to share this nonwhite washed story of mine where everything is going good. I understand this is adulthood and may have realized this too late. I am not saying other universities are anyway better than UBC in any aspect. I just want to finish this off by even though the world seems so dark there is always this hope and light at the end of the tunnel."
0.141,0.859,0.0,-0.4215,UBC Is Spending Millions Re-Doing The Washrooms When Students Are Literally Starving and on the Verge of Homelessness.
